movie_id,movie_title,rating,review
8835,Legally Blonde,7.0,"An entertaining movie that with the title alone alerts you that it is brazenly silly, though Reese Witherspoon's character Elle Woods has challenges that make you cheer for her. Awkward social situations are well handled by the character and credit to the writers and director for resolving these with good morals. All of the major cast roles are well done."
8835,Legally Blonde,7.0,"Surprisingly funny and good. I was expecting this to be a dumb movie honestly. They did a good job. Yeah she was a blonde and acted like blonde, but she was legally smart at being an attorney."
8835,Legally Blonde,7.0,"<em>'Legally Blonde'</em> is good. There is plenty of cheese and you can see where the story is heading from basically the get-go, though it is all brought to life by an impressive Reese Witherspoon performance. There are amusing moments, plus it has a pleasantly short run time. Overall, I did find it enjoyable."
8843,The Cell,6.0,"I can't... I can't call _The Cell_ good... But it's artistically spectacular, features one of D'Onofrio's best roles ever, and though it has unoriginal concepts, it uses them in originally thematic ways. I can't call _The Cell_ good... But I can tell you to watch it.

_Final rating:★★★ - I liked it. Would personally recommend you give it a go._"
8843,The Cell,10.0,"The Cell is a forgotten classic. Way ahead of its time, it is a cinematic delight. It could be best described as a psychological thriller but it is so much more. Don't hesitate to enjoy this gem. It is visually stunning with a gripping story. JLo is good in this despite her booty never being the focus. Yes, it makes an appearance in a side view but it doesn't overwhelm. For serious, this is a 10-star film. Have fun!"
8844,Jumanji,7.0,The original movie. Robin Williams makes this movie funny. Honestly without him the movie would be nothing.
8845,Under Siege,7.0,"The fun kind of dumb, _Under Siege_ is probably Segal's best work, and in my opinion the only reason people ever mention him in the same breath as the likes of Stallone, Schwarzenegger or Willis.

_Final rating:★★★½ - I really liked it. Would strongly recommend you give it your time_."
8849,Alfie,5.0,"Some films just don't need an ""update"". ""Alfie"" certainly didn't. Certainly Jude Law has a certain je ne sais quoi reprising the Michael Caine role as the womanising philanderer. His normal hump 'em and dump' em strategy is soon seriously compromised by his inability to ""perform"" and this has all sorts of ramifications on his shallow existence (relocated to New York in this version). Sienna Miller and Susan Sarandon fail to help lift this great looking but intellectually void film get going, and Law - though every inch the dapper, gorgeous, gigolo to look at - just hasn't the charm or sleaziness of Caine. It does have a decent soundtrack, but not the same with out Cilla Black..."
8850,The Shadow,8.0,"A tongue-in-cheek nostalgic throwback to the thirties and forties. Love the style, the imagery and the period. Heaps of fun!"
8851,The Blob,8.0,"The campy theme over the strange title sequence may make you think it will be a very campy horror film that doesn't take itself seriously, you would be half right, but you'd also be half wrong. It is campy, but it takes its self seriously most of the time.

Everytime I watch it it gets a few laughs and giggles out of me, I've been watching it since I was five and I recently watched it for the 7th time.

I would give it a 7.4/10."
8854,Steel,2.0,"_Steel_ is **so** far removed from the source material that I honestly feel like they could have made exactly the same movie, called it something else, and nobody would ever assume that it has anything to do with the DC Comics character.

Oh also it sucks.

_Final rating:★ - Of no value. Avoid at all costs._"
8854,Steel,8.0,"This movie sits firmly in the ""It's so bad that it's good"" category. If you watch this review, you will see exactly why this is the case...
https://odysee.com/@SpaceIce:8/shaq's-movie-'steel'-proved-sledgehammer:8"
8866,The Truth About Cats & Dogs,6.0,"Good watch, could watch again, and can recommend.

This movie has held up over a long period of time due to stellar performances by Janeane Garofalo and Uma Thurman, and that's really all it has going for it.  Great actors giving solid delivery in a decent script.

It does remind me of Cyrano de Bergerac a bit, but it's a classic switcheroo trope for a romantic comedy that gives a life lesson of beauty is what you make of it.

My biggest problem is that they basically call Garofalo ugly because she's not Thurman, which doesn't make sense to me.

Other that that, the script is strong enough without being spectacular, and I feel like the cast had to work very hard to make the movie what it is.

A modern day reboot is surely on the way with it being about a podcast of the same name."
8867,The Punisher,2.0,Almost works more as a goofball comedy mocking all those action films of the 1980's. Almost. Gossett comes off so much better than the material handed to him.
8870,Red Planet,4.0,"_Red Planet_ has so much going on, and it doesn't have control of any of it. Not a single actor fits their character, except possibly Carrie-Ann Moss, who spends basically the entire runtime too benched to really count as a character in 99% of the story anyway.

_Final rating:★★ - Had some things that appeal to me, but a poor finished product._"
8871,How the Grinch Stole Christmas,7.0,"I'm not gonna lie, this version of the Grinch scared the crap out of me when I was a kid!

But as I got older I started to get use to it.
The trick was to just listen to the whole thing without looking at it and gradually (each year take a peak)."
8871,How the Grinch Stole Christmas,7.0,At first I didn't like this movie. It's one of my daughters favorites tho. So she would always want to watch a lot around Christmas time. Now I don't mind it and it's like a Christmas tradition for us now to watch this movie.
8871,How the Grinch Stole Christmas,7.0,This is my favorite version and has been my favorite since I was a small child.
8872,Wayne's World,7.0,I wish I could dress the exact same every day and still be cool.
8874,My Best Friend's Wedding,8.0,I don't know why I like this movie. I think it's just because of how crazy funny Julia Roberts starts acting when she finds out her best friend is getting married. Kind of reminds me of some of my crazy ex's.
8879,Pale Rider,8.0,"This is a good'un.

<em>'Pale Rider'</em> features an enjoyable story featuring the gold rush, while the characters are all solid - Clint Eastwood gives a strong performance in the lead role, though I would've liked to have seen more of John Russell and his character.

I don't think it's perfect or anything, but I got entertainment from it and that's enough for me - I've not got much more to note."
8883,Flame & Citron,8.0,"Very interesting story!

<em>'Flame & Citron'</em> is a film certainly worthy of your time. It does probably overrun a little with a 130 minute run time and could pick up the pace here and there, though overall this historical drama from 2008 makes for intruiging viewing. It's very well made.

I had no knowledge of the real life of those portrayed, so it's good to learn of their World War II involvement; albeit with the usual stretched truth/fictionalization/whatever that films tend to do. The titular characters are played by Thure Lindhardt and Mads Mikkelsen, both give super performances as the former particularly impresses."
8913,Pet Sematary,6.0,"Even if it wasn't any good, Pet Sematary's sort of a must watch given how heavily it's been referenced in the film and television industries since. But it is good, so there's that too.

_Final rating:★★★ - I liked it. Would personally recommend you give it a go._"
8914,Deep Blue Sea,5.0,"There's quite a cast assembled for _Deep Blue Sea_, not what we've come to expect from the Asuylum-soiled genre of shark movies in this day and age. It's not a fantastic movie, but it proves more watchable that 90% of its company.

_Final rating:★★½ - Had a lot that appealed to me, didn’t quite work as a whole_."
8914,Deep Blue Sea,6.0,"An engaging thriller with a mindless plot, Deep Blue Sea managed to keep me hooked throughout its loud 100-minute running time. A doctor and her team of researchers looking to find a cure for Alzheimer's in sharks in an isolated facility in the middle of an ocean - what more do you need for some sweet chaos while also supported by some unethical practices? Deep Blue Sea is not the most realistic shark film out there but it has a lot of cool action, suspense, the added pleasure of flooding sequences, and a protagonist that you love to hate. Go for it. (Grade B-). TN."
8914,Deep Blue Sea,7.0,"**Peak corny shark goodness!** 🦈🦈🦈

Deep Blue Sea falls prey to every shark movie trope and has a blast doing it. Embracing its cheesiness makes this movie one is the all-time best shark flicks—a fabulous cocktail of 90s cheese, sharks, and surprising twists. If you haven’t seen this one, I guarantee you will be surprised by who survives and who doesn’t."
8916,Antz,5.0,Didn't know what to expect from this movie. It was surprisingly good. Very funny with a decent storyline.
8916,Antz,4.0,It's an animated movie with voices from lots of big-name stars and it's quite fun. But I'm still embarrassed I own it.
8920,Garfield,8.0,Like this movie. I always enjoy the real versions of animated movies. This was done well. Garfield being pissed off at Odie for John bringing him home.
8922,Jeepers Creepers,,I loved this movie.For it's budget & little CGI used.It was a great thriller.I don't consider it as horror.I'm sure many don't agree.I have been hoping for a new movie.
8922,Jeepers Creepers,7.0,"An under-appreciated horror piece from my formative years, best watched going in with no clue what you are in for.

_Final rating: ★★★½ - I strongly recommend you make the time._"
8922,Jeepers Creepers,6.0,"Just OK. Justin Long is his usual quirky, excellent self. Gina Philips plays the sometimes right, sometimes wrong older sister. Won't be watching the other ones..."
8923,Green Street Hooligans,9.0,"Woefully underrated drama too often passed off as a ""boy's night"" action film.

_Final rating:★★★★½ - Ridiculously strong appeal. I can’t stop thinking about it._"
8960,Hancock,1.0,"Yeah, this stank.

Hancock had character at the start of the film, but that slowly faded away by the second half, that just sort of floundered until it ended.

It lacked the humor that comes with a lot of Will Smith's other outings, and it lacks the charisma that usually seeps out of Smith.

It just seemed to fail on every front."
8960,Hancock,8.0,I like this movie because it's different from your typical superhero character. He cracks me up to. They have some pretty cool fight scenes in this.
8961,Bad Boys II,8.0,"Really funny, and action packed. One of my favorite movies of all time."
8967,The Tree of Life,5.0,"A movie that wants to mean more than what is actually telling.

Taking a lot of things borrowed from 2001, it doesn't even come close to have such a deep an interesting meaning."
8968,Boogeyman,8.0,Everyone is afraid of the boogeyman. I really like this movie. I love a good horror flick.
8970,The Out-of-Towners,6.0,"_**Fun with Steve Martin & Goldie Hawn in Massachusetts and New York City**_

An empty nest couple from Ohio (Steve Martin & Goldie Hawn) travels to the Big Apple and has many misadventures as they reevaluate their relationship and lives. John Cleese plays a hotel manager.

""The Out-of-Towners"" (1999) is a remake of the 1970 comedy, which I’ve never seen. Critics are too hard on it since it gives ya what ya pay for: A fun hour and a half with a spirited cast and quality locations.  

The film was shot in Massachusetts (Arlington & the turnpike) and New York City with some stuff done in Los Angeles & Santa Ana (the airport).

GRADE: B-"
8974,The War of the Worlds,6.0,"Not great in terms of the script, acting or the abrupt ending, the practical effects were impressive and a lot of fun with the Martian ships flying and causing mayhem and destruction. I can imagine this wowed audiences back in '53. **3.0/5**"
8983,Felidae,,The film was released in youtube premiere on August 2013. Movie is not for children. For older teens and up.
8997,Hollow Man II,3.0,"_Hollow Man II_ takes it a different way, which is fine, different's not just good, in this case, I think it's necessary. But the biggest difference between _Hollow Man_ #1 and #2, is that #2 is boring. I don't ask that it have the same intrigue as the first, just that it have any. Anything to take it beyond ""There is a man and he's invisible and he's bad and the protagonist is not"".

_Final rating:★½: - Boring/disappointing. Avoid where possible._"
8999,Derailed,6.0,Could've been better but still an effective enough suspense-thriller. I remember seeing this in theaters back in 2005 and probably the bigger surprise was seeing Jennifer Aniston playing against type. This was also a time period where it seemed Clive Owen was everywhere. **3.25/5**
9007,Just Like Heaven,8.0,"It's a little heavy-footed and almost tries too hard, yet I quite enjoyed <em>'Just Like Heaven'</em>.

Reese Witherspoon and Mark Ruffalo are a strong pairing, with Jon Heder spearheading a good support cast ably. It's a well paced film at around 90 minutes, there are some decently amusing scenes in there alongside some more sombre ones - the majority of which come off rather well. Some parts are cliché, but not to the degree that it affected my enjoyment.

One that is well worth a watch, in my opinion of course."
9013,Midnight Run,10.0,"""Midnight Run"" has a generous measure of wonderfully executed action sequences and comedy that is genuinely funny, although there is an extremely high reliance upon swearing and this will undoubtedly offend and alienate the more sensitive souls sitting out there in the audience. This is also a hugely entertaining film which contains a number of memorable Robert De Niro moments - he is fascinating to watch during the scene where he visits his ex-wife Gail to borrow some money (this, in turn, leads to a spectacularly awkward encounter with his daughter which eventually ends in embarrassing silence) and again when he finally comes face to face with Jimmy Serrano, an unwelcome face from his past - and the many locations look absolutely gorgeous."
9016,Treasure Planet,7.0,"Loosely based on one of my favourite stories, this version of Robert Louis Stevenson's ""Treasure Island"" sees the young Jim Hawkins on a magical adventure on a space galleon. Befriended by the cyborg cook ""Silver"" they face all sorts of perils on their journey before arriving at the ""Treasure Planet"" whereupon the young lad realises that his pal isn't quite so trustworthy. It's a great adventure story, the voice talents are fun making their mischievous characters engaging to watch - and the animation, though maybe not quite as vivid and detailed as I would have liked, still keeps the narrative alive and thriving. Still not a patch on the superb Robert Newton version (1950) but still a very entertaining watch."
9017,Outpost,6.0,"This film should have been more than it was. The premise is great, the atmosphere is spot-on, the costumes and make-up are menacing and the characters are pretty decent. This menace is somehow lost, however, at some point during the overblown final plot-arc, which is a major shame because it really looks stunning and builds up some satisfying apprehension.
I cannot give it less than three stars, but only because I absolutely love this sort of thing, having grown up with Wolfenstein and Doom to take me to the early hours. One day somebody will nail this idea and unleash true grim krieg."
9021,The Santa Clause 2,7.0,"I think it's good.

To me, <em>'The Santa Clause 2'</em> runs the original film very close. I found the plot to this one more consistently enjoyable, whereas the first one starts off stronger than it finishes - I'd still class the 1994 production better, but this is a solid sequel in my opinion.

Tim Allen reprises his role as Scott and continues to be showpiece of the film. Elizabeth Mitchell is decent as Carol, while Spencer Breslin - who is good in <em>'The Cat in the Hat'</em>, and yes I like that film - fits his character well. My point being, this has a slightly improved support cast.

Going back to the premise itself, it's nothing to take seriously of course but I felt suitably entertained by it. Intrigued to see where the second sequel goes."
9032,Big Daddy,6.0,"Good watch, could watch agian, and can recommeond.

While it's a typical Happy Madiosn / Adam Sandler, the importance of the child's welfare kind of balances it out as far as ""seriousness"" goes.

The humor stands up, even if some of it is problematic, but even then that was the point, to push boundaries.

It's a funny, charming movie that reminds of a time when I didn't like Leslie Mann, mostly because she got written into to some jerk roles, more than just being a straight man, like ""vengeful woman"" jerk, and even with her being ""in the right"" about it, she still comes off a a villain, in place of an antagonist other than ""life"".

The movie is exactly what the premise is: by horrible circumstance some kid gets stuck with Adam Sandler, comedy ensues.  Nothing really special, but it's not bad even after 20 years."
9032,Big Daddy,10.0,One of my favorite Adam Sandler movies. This movie is hilarious. My daughter loved this movie as a kid as well. Now that she is a teen she loves Adam Sandler but always calls him big daddy. She says that's the only way she could remember him.
9035,Slither,8.0,"A comedy-horror riff on an alien-parasite invasion of a small rural town is fun, gross and completely engaging. James Gunn demonstrates his pre-GOG chops, getting the most of the great acting ensemble including Elizabeth Banks, Michael Rooker, and Nathan Fillon."
9036,Eight Below,7.0,"Not as dark or heart-wrenching as it could've, and perhaps should've, been. With that noted, <em>'Eight Below'</em> - a remake of 1983's <em>'Antarctica'</em> - is still a fairly decent survival drama.

The cast certainly elevate my feelings towards the film, with Paul Walker impressing in the lead role; it comes across as if he actually does have a bond with the dogs, which is obviously key.

It's very much Walker's show, but Bruce Greenwood, Jason Biggs and Moon Bloodgood all add small but welcomed things with their characters. The dogs themselves are great and do a lot of good work onscreen, a load of which being pretty believable.

There are saddening parts to it, for sure, but overall I wanted a more deeper ride with this premise than what I got, but there's definitely reasons to watch it."
9037,Grease 2,4.0,Not any where close as good as the first. Just not the same vibe. The songs are horrible. Also the storyline is horrible.
9043,The Family Stone,,"Fun, Entertaining, and VERY Predictable. This christmas based romantic comedy made me miss my own dysfunctional family. The Family Stone can be enjoyed by all. Luke Wilson was hilarious. Claire Danes looked great and Diane Keaton made this family. You'll laugh, You'll Cry, and you might want to call your Mom after watching this."
9051,10,6.0,"Another stupid comedy about the mid-life crisis of a man and his obsession with a beautiful woman, until he realizes that the obsession is senseless. Quite similar to other movies la ""The Woman in Red""."
9051,10,7.0,"First half is pretty slow, but it gets much funnier once Dudley Moore begins his famous drunk routine."
9051,10,7.0,"First half is pretty slow, but it gets much funnier once Dudley Moore begins his famous drunk routine."
9057,Terminal Velocity,5.0,"Man of the moment Charlie Sheen is ""Ditch"", an accident-prone, pain in the neck skydiver. When one of his passengers (Nastassja Kinski), ostensibly on her first jump, hits the ground with one hell of a thud, he is certain that he took all the steps necessary to ensure her safety. What happened? Well nothing is quite as it seems, and soon he is on the trail of some dodgy KGB agents after some airborne gold. There is plenty of action, to be fair, but the film is simply a vehicle for Sheen, and he has long since lost his boyish charms. The dialogue seems to have emerged from a teenage scriptwriters meeting that decided ""let's use some smutty words, tee tee"", and the plot is really pretty thin and lacklustre. Some films just don't have much of a shelf life - this is certainly one of those."
9058,Only You,6.0,Your typical love story. Girl was told the name of the man she will marry one day by a fortune teller. She believed it and meets a guy who lies and says that is his name.
9059,Tales from the Crypt: Demon Knight,6.0,"Yeeeeeeaaaaaaah booooyyyyyyy.

I have very fond memories of _Demon Knight_ from the days of the active horror community on Tumblr. I don't know if this is ""good"", but must a movie be ""good""? Can we not simply have BIlly Zane wearing sunglasses in the dark, commanding his squad of practical effect demon puppets, and call it a day?

Sidenote: I know this is a _Tales from the Crypt_ movie, but I would happily have given up the Cryptkeeper bookends for 5 more minutes of the actually story, silly as it is.

_Final rating:★★★ - I liked it. Would personally recommend you give it a go._"
9062,Love Story,7.0,"Well acted tear-jerker has some nice scenes and dialogue between Ryan O'Neil and Ali MacGraw, and thankfully not overly schmaltzy. Today this sort of thing would be on Lifetime but back in 70 was a box office hit. Not sure it's something I'll watch again anytime soon but decent for a romance-drama. **3.5/5**"
9064,Hellbound: Hellraiser II,7.0,"Pretty out there (in a good way) sequel that doesn't make a whole lot of sense but still was an entertaining supernatural horror flick, the kind of horror I'm generally not a fan of. Kind of surprising Ashley Laurence didn't go on to bigger things (her last movie was 2008). **3.5/5**"
9064,Hellbound: Hellraiser II,5.0,"""Hellbound: Hellraiser II"" is watchable enough even though it very quickly slides down the steep slope into becoming a messy shambles. It is really nothing more than a tour through the diseased imagination of Clive Barker - it is hard to believe somebody out there actually thought this was a good basis for a film instead of seeking out some description of psychiatric treatment for the poor soul - and its major handicap is that the special effects just aren't up to the challenge of supporting his thoroughly twisted and uniquely original vision. There  is also a desperately heavy reliance on copious amounts of blood and gore just for the hell of it and when you add in the fact that sadly a good portion of it is also totally forgettable what you're left with is nothing more than a modest gore fest of desperately limited impact."
9065,Europa,8.0,"Goodtropa.  One thing you can say about this film is you have never seen anything like it before. Most chilling is the soundtrack, although von Trier does over-direct once in a while. I did appreciate this more than his ""Breaking the Waves."""
9077,Tarantula,6.0,"Allowing for the fact that the special effects are getting on for 65 years old, this is a cracking little sci-fi/horror feature. John Agar is the scientist on the trail of an industrial-sized spider that is wreaking havoc on a local Arizona community. Leo G. Carroll (in increasingly ""Elephant Man"" style make up) and Mara Corday help keep this Jack Arnold film moving along well. Herman Stein's music is a little derivative but it also helps to create some tension as they all race to stop the arachnid terror from desiccating everything it meets."
9089,Home for the Holidays,4.0,"The dialogue is a bit unnatural and the characters are over the top, but it's okay. Worth watching if you're in the mood for a light-hearted 90s family comedy/drama. It has its moments."
9102,Screamers,6.0,"Unfortunately, not quite the movie I remember it being when I was a kid. Not bad, even worth watching, especially for Peter Weller, but I think I had made a better version of it in my head in the twenty years since the last time I watched it, so this re-visit was a little disappointing.

_Final rating:★★★ - I liked it. Would personally recommend you give it a go._"
9266,Blue Crush,5.0,It's a decent movie but I'm not really into surfing. The girls aren't even attractive either. I only watched this cause it was a free movie.
9267,And Now for Something Completely Different,5.0,"I probably expected too much from this.
The theater advertised a showing of Holy Grail, so I went in with the usual expectations of rolling in the aisles with laughter, but this showed instead.
It was fairly funny, but I don't think they did their best material for the most part, in this movie.
Still, it had some laughs."
9270,Brick,8.5,With its hip lyrics and 50's styled character speak BRICK is an instant classic. It has a streak of REBEL WITHOUT A CAUSE in it. The eclectic arrangement of the deranged is inventive and full of texture. I own it and watch it often!
