movie_id,movie_title,rating,review
9582,A Guy Thing,5.0,"Decent watch, might watch again, but hard to recommend.

Don't get me wrong, I like the movie: it's well casted, has a decent story and production value, but even at the time of release, it wasn't great.

There are some really funny moments, and if I were Jason Lee, I think I would have some trouble choosing between Selma Blair and Julia Stiles too, but it's mostly ""what awful things can we do to him"" humor.  Ants under a magnifying glass just aren't all that satisfying.

The upside is that there are some very cleverly crafted characters and acting even beyond that.

There are plenty of probably better movies out there, especially after all this time."
9586,The Bonfire of the Vanities,3.0,"This movie is utter tripe and ruins a great book.
It’s such a mess. Avoid at all costs.
Edward E.Grant does his overacting routine which is really cringeworthy and bombastic!

Avoid!!"
9587,Little Women,8.0,"Moderately faithful to the books, this movie does well to maintain the magic in a 90s cinematography capsule. It has excellent casting and hosts very strong performances from all.
A lovely piece of media."
9592,Open Water 2: Adrift,3.0,"The jump in video quality from the first _Open Water_ movie to this one is **astounding**. But it's still real bad. Plus, this isn't even a shark movie! I know it isn't specifically touted to be one, but I was still very surprised. Honestly, I think what happened here was someone wanted to make a very stupid movie, but were then informed that a movie, near identical in both plot and stupidity, already existed, and to cover their tracks, they quickly decide all of a sudden that this movie was a ""sequel"" to the original _Open Water_. I guess it was kind of cool seeing the guy that plays Loki/Gabriel in Supernatural in another role, but I can't imagine that's a thing that'll carry much weight with audiences in general.

_Final rating:★½: - Boring/disappointing. Avoid where possible._"
9592,Open Water 2: Adrift,7.0,"This is not a shark movie as I had thought nor a related sequel to the equally charming first instalment in the Open Water series, but it did get me hooked quickly when a group of friends impulsively decide to take a dive in open waters without lowering the ladder on their yacht. It's crazy how things move from there with basic instincts kicking in and the blame game starting up. It's solid entertainment if you are into survival thrillers. Has a few clichés here and there, but overall Adrift gave me a good 90 minutes of pure thrills. (Grade B). TN."
9593,Last Action Hero,6.0,"Having just watched this for the first time in 2018, I wonder if Arnold Schwarzenegger had intended for this to be a sort of retirement movie. It very much has that vibe, and would have worked spectacularly to that end in a fun, meta, kind of way. But for better (_Maggie_) or worse (_Terminator 3_) Arnie just keeps on sluggin' and that's the world we live in.

So instead of that, I guess _Last Action Hero_ is really just a deconstruction of the over the top action movies the 80s and early 90s did with such aplomb. Is it a scathing criticism of them, or a love letter to them? I don't know, but _Last Action Hero_ works for me, and that's all I'm taking away from it.

_Final rating:★★★ - I liked it. Would personally recommend you give it a go._"
9594,Double Impact,4.0,"So there is a line in here that I identify with: ""Never in my life would I wear black silk underwear,"" and that really needs to be your only take away.

Because, honestly, what could be worse than Jean-Claude Van Damme's acting? Twice as much of Jean-Claude Van Damme's acting. There are two stars of this movie and he is both of them.

However, it does hit most of the tropes of boobs, fights, and guns. The only down side is that even with hitting all the tropes, it's still pretty unwatchable, even for a Jean-Claude Van Damme movie."
9598,Babe,1.0,Truly disgusting type of entertainment that inspires vegetarianism! It also has a scene too much to be in a children’s film that reflects on domestic violence (between two dogs). The producers who made this sort of junk were obviously nuts in the head to put such a scene like this into such family oriented film. Please do not watch after seeing this review. You do not especially want to get inspired by such propaganda about using certain animals as food.
9599,The Blob,8.0,"Nifty remake of the 1958 classic. This story of a shapeless, featureless space alien, instead of the usual ""little green men"", opens the door for a decidedly different kind of invasion movie. This version stays pretty true to the original and the advancement of special effects over 30 years allows for some really great and gory kills. The best being a victim being pulled into a sink drain and a wicked attack of a main character in a doctor's office.

There are some effects that aren't so good though, you'll scoff when you see them. The acting is really very good, and it's got its share of moments that are actually scary. The characters, even the primaries, could get swallowed up at any time. I'd say this is a must watch for any fan of the original."
9599,The Blob,5.0,"The best joke was when they described the Blob as ""a plasmic life form growing at a geometric rate."" 😂 I even just laughed while writing it down 😂

Other than that, pretty bad. And the campiness doesn't feel fresh for long, turning it into a rather boring watch right when it's supposed to start to be exciting.

Still, worth a watch."
9599,The Blob,9.0,"This is definitely the most brutal horror film I've ever seen and one of the best aswell. The effects in this film are top notch and the storyline is much stronger than the original, the acting is more believable too. This film is nothing short of a horror classic."
9600,Big Momma's House,8.0,"Before there was Madea, there was Martin Lawrence as Big Momma. I love this movie. Freaking hilarious."
9602,Coming to America,5.0,"Hasn't aged flawlessly, made some stylistic decisions that probably would have come across as weird even at the time, and not the sort of thing (American comedy) that typically appeals to me. But I can still absolutely see why _Coming to America_ is remembered as fondly as it is. I liked it by and large more than the most similar offerings of today.

_Final rating:★★½ - Not quite for me, but I definitely get the appeal._"
9602,Coming to America,7.0,"Really good watch, would watch again, and can recommend.

A very good approach to a ""Pauper and Prince"" trope mix with a culture shock trope.  The excellent cast involved really takes it a long way with good writing to help it along.

It's admittedly not a very original story structure, so while it is not all that refreshingly unpredictable, but it's good to see a foreign royalty in an American setting, and an African one at that.

I do think this is consistently funny and has maintained over 30 years, so definitely check this out if you haven't."
9602,Coming to America,,"_Coming to America_ is a classic 80's comedy with excellent performances by Eddie Murphy and Arsenio Hall. The film's humor holds up well over time, and the duo's ability to portray a variety of different characters is impressive. While some aspects of the film may be dated, it remains a hilarious and heartwarming story about love and acceptance. Overall, _Coming to America_ is a timeless classic and one of the greatest comedies of the 80’s. I would highly recommend it to anyone looking for a good laugh."
9603,Clueless,7.0,"I remember growing up watching this movie. I liked it for probably different reasons then others like it. I liked it because I hated girls like her. So I thought she just looked ridiculous the whole movie which made it funny to me. Favorite line: ""Why would I listen to you? Your a virgin that can't drive!"" LoL!"
9604,Red Heat,7.0,"Entertaining enough buddy-cop movie has some fun action scenes (the bus chase sequence was great). Only thing holding it back was the pairing of Schwarzenegger and Belushi never quite worked for me. Still a good flick from Walter Hill, though not sure it ranks all that high compared with others from the era. **3.5/5**"
9606,Metropolis,3.0,Style carefully cared but the plot is expectable and the dialogues cheesy.
9612,Coneheads,10.0,"Coneheads, yeah, it's one of the FEW SNL movies that turned out right, especially since it came so long after the Conehead sketches stopped airing.

But then it was back before SNL made it's downward spiral to the dust bin.

It has an all star cast, and in even the small roles. It has a cast that was, more or less, the who is who of comedy in the early 90s, and is executed in way that actually tells a story... and that is what sets it apart from a lot of SNL movies (more modern movies in general), it actually tells a coherent story and takes the time to develop the characters.

Because of that, you have a sense of real family and their plights have a meaningful resonance that only comes with the well developed mind of a skilled writer and director."
9614,Happy Gilmore,10.0,"Adam Sandler makes so many good movies. Who doesn't love this movie. If you don't like this, then there's something wrong with you. The price is wrong bitch!"
9615,The Fast and the Furious: Tokyo Drift,5.0,"My wife loves the franchise... I'm 3 deep and really not seeing the appeal.  But, I do like the accent, it's a rarity that you see a film with a southern accent on the lead, and that is refreshing.  Especially out in Japan, or anywhere that has an American abroad.

The High school thing wasn't so much my speed.  Neither was the reason why he ended up in Japan, where the problems he would have with driving and racing were resolved with... a phone call.

And then I spent the majority of the time watching this and wondering how much money people in Japan spend on front end alignments and that was about as challenging as the movie got for me.  Otherwise it was pretty paint by numbers from start to finish.

But hey, the colors popped."
9616,The Order,3.0,"Oof.

Kind of feels like the pitch meeting for this one basically went:

""So I was just reading about the idea of this 'Sin Eater' thing on Wikipedia the other day, it actually sounds really interesting, I'm super keen to put it in a movie!""

""Oh great, so what's the story gonna be?""

""I'm sorry the what?""

""The story. You can't just say you're gonna put a Sin Eater in 'a movie' you have to like... Actually make the movie that it goes in. What's the movie gonna be about?""

""...Oh no.""

""I mean it'll probably be fine.""

""Right? It'll probably be fine.""

_Final rating:★½: - Boring/disappointing. Avoid where possible._"
9620,Paycheck,4.0,"Oh dear, this one's pretty bad. There are a lot of faces in this movie but non of them could save this disaster. Which is a shame, because this could have been a really intense and thrilling film in the hands of a different director. Instead, it comes across as a made-for-TV movie. John Woo's direction is lacklustre and cliche, the editing is lazy and the soundtrack is overblown, unfitting and downright intrusive."
9621,Elizabethtown,7.0,"Charming if not uneven romantic-drama-comedy that has its moments though Orlando Bloom's narration felt stilted at times, but I liked his interactions with Kirsten Dunst. A bit weak compared with Cameron Crowe's other works, still liked it enough. **3.5/5**"
9622,Beverly Hills Ninja,7.0,I forgot how funny this movie is. I used to watch this all the time. Still as funny now as it was back then.
9645,Ghost Ship,3.0,"I remember thinking this was good as a child... I was wrong.

_Final rating:★½: - Boring/disappointing. Avoid if possible._"
9645,Ghost Ship,5.0,"Another second viewing flick, wasn't a big fan the first time and basically thought the same now. There are some fun cheesy moments here and there but kind of like Thirteen Ghosts (same director), has some interesting ideas that don't amount to much. Course, I'm also not much of a fan of supernatural horror movies as they play fast and loose with the rules. **2.5/5**"
9645,Ghost Ship,6.0,"Besides **THAT** epic death scene, this movie is mildly entertaining. It has flaws and a terrible story, which I admit the reveal was amusing. If you like terror on the seas but amusingly bad to riff on, this’ll be the movie. That opening scene is memorable for a reason though and basically overshadowed the rest of the movie."
9645,Ghost Ship,6.0,The beginning and the end of this movie is really the only good thing about the movie. Everything else is just a crew chasing around a ghost girl trying to figure out what happened to her. Pretty boring.
9647,Scrooged,8.0,"""Scrooged"" has been suggested by ""A Christmas Carol"" by Charles Dickens and the familiar themes this film tackles are becoming increasingly relevant with the passing of each year as the human race becomes even more isolated and jaded than ever before by the unceasing and repetitive grinds and demands of daily life where considerations such as kindness and a generosity of spirit are fading fast and in danger of never being recovered after they have been lost. This film attempts to address the malaise and remind people that life is only worth living when it is done with a genuine sense of charity towards other people and this shouldn't be restricted to just one day of the year. The Christmas spirit can and should be adopted as a lifestyle choice and the repeated attempts to attain this goal ought to be the only insatiable greed in the world today."
9651,Supergirl,5.0,"<em>'Supergirl'</em> is a second straight dud from this franchise, though I'd honestly say it's ever so slightly more interesting than the preceding <em>'Superman III'</em>; it at least tries to tell a coherant story around its main character, which can't exactly be said for the aforementioned.

Helen Slater is decent as Supergirl, any complaints with the character lie with how she is written rather than how she is portrayed by Slater. The best part of this movie, for me, is actually Faye Dunaway. Selena isn't necessarily a plus, though I think Dunaway's performance held potential.

Peter O'Toole has a small part to play, nice to have an actor like him involved - on a similar note, it's a shame Christopher Reeve turned down a cameo, not that you could blame him of course. All in all, this is a disappointing movie. A shorter run time might've helped, fwiw."
9654,The Italian Job,8.0,"**The Italian Job is a cool, sleek action-packed film with a fantastic cast and incredible stunts.**

The Italian Job achieves the impossible - making mini coopers cool! With a cast filled with stars from Mark Wahlberg to Jason Statham to Charlize Theron, this high-paced, high-energy film oozes swagger and awesomeness. This close-knit band of thieves is on a mission of revenge to steal from the man that betrayed them all and murdered their leader. With the moral high ground and proper motivation, these characters become that much cooler and are that much easier to root for as they break the rules in pursuit of their quarry. The stunt driving and camera work meld together perfectly to create a stunning high-octane movie that is exciting, fun, and worth seeing again and again."
9654,The Italian Job,8.0,"Seen this one a few times over the years and still holds up as a light-hearted and fun heist-thriller. The ensemble cast with Wahlberg, Theron, Green and Mos Def, all have great chemistry. A shame the planned sequel never came to fruition, though surprised Paramount hasn't attempted to do one even if they could only bring back a couple actors like Wahlberg and Theron. Still distracting watching Norton knowing he was forced into doing this movie. And maybe sacrilege but I prefer this one over the 1969 original. **4.0/5**"
9656,Black Christmas,5.0,"Obviously doesn't hold a candle to the original, and some of the acting is pretty genuinely bad, but it knows what it wants and it goes for it. What it wants, here being: To be hamstrung to keeping in step with its predecessor but also being wildly different enough to piss anyone off who was expecting an actual ""remake"".

_Final rating:★★½ - Had a lot that appealed to me, didn’t quite work as a whole._"
9659,Mad Max,9.0,"Who'd have thought we'd still be talking about a $350,000 film, 40 years after it was made? And who'd have thought it would be in a positive way.
_Mad Max_ was one of the most formative films ever released, and not only is **one of** my favourite films, but is chief inspiration to my **actual** favourite film of all time, Neil Marshall's _Doomsday_.

_Final rating:★★★★½ - Ridiculously strong appeal. I can’t stop thinking about it._"
9659,Mad Max,8.0,"For whatever reason, never had seen the original and doesn't disappoint, some good action and gut wrenching scenes defying the rules of killing pets and kids, Mel Gibson is quite good in the role and look forward to checking out the sequels. **3.75/5**"
9663,Starman,10.0,"Look who directed it... and that raises a lot of questions doesn't it? I mean it's espically good and then you see it's john Carpenter doing a... a love story and a very moving and beautiful love story.

I guess the draft Carpenter got was extremely political... and he took all the politics out and focused on the love story, that was a great call, it was a great call in the 80s and it is great advice for today.

And it's good with Bridges doing a stellar job, and he really didn't learn how to act until the 90s.

I totally forgot about it, and then my wife and I saw it, hadn't seen it since the 80s and forgot how amazing it was. It stands the test of time, it's moving, it's beautiful, and it entertains... you can't ask for more."
9671,Crocodile Dundee,7.0,Loose plot but Paul Hogan shines as Dundee and it's just an all around feel-good film that one can't help but put a smile on your face. Seen this a few times over the years but still holds up. **3.75/5**
9675,Sideways,9.0,"_""If anyone orders Merlot, I'm leaving. I am NOT drinking any fucking Merlot""_

As I get older, I have realized that this movie is written really well. Paul Giamatti and Thomas Haden Church have a hilarious chemistry and I can't help but agree with Miles a few times. I wish I loved wine like Miles does, but I do love hearing him describe each one with a passion."
9678,Little Nicky,7.0,"I don't like American Comedies, and I especially don't like Adam Sandler, but for whatever reason, I love _Little Nicky_. Maybe it's A) because I was big into the heavy-metal-heavy Satanic themes when I first saw it at a mere 7 years old, or maybe it's B) because of how young and therefore unrefined my taste was I was when I first saw it, or maybe C) it's just... Actually good?

Almost certainly a combination of A and B.

_Final rating:★★★½ - I really liked it. Would strongly recommend you give it your time._"
9678,Little Nicky,6.0,Different kind of role for Adam Sandler. He played it to perfection. He is the devil's son who doesn't even want him. His mother is an angel in heaven.
9679,Gone in Sixty Seconds,7.0,"Needed non-stop action. Too much talk, too long a run time.

<em>'Gone in Sixty Seconds'</em> does produce some fun action, but I personally felt an extra notch of thrill was needed with this; especially as it lasts for 118 minutes. Some parts are very ploddy, a shortened run time would've worked wonders.

Nicolas Cage is amusing in this, his character Memphis is actually quite goofy. The cast around him are pretty good, with a whole host of familiar names/faces. Angelina Jolie appears as Sway, with Giovanni Ribisi (Kip) and Vinnie Jones (Sphinx) in there too. Christopher Eccleston, meanwhile, makes for a decent bad guy.

Good fun, could've been far more entertaining though."
9679,Gone in Sixty Seconds,9.0,"**Ocean’s Eleven vibes with an endearing ensemble cast and cars instead of casinos.**

Gone in 60 Seconds is fun. Plain and simple. This entertaining, high-energy action romp is fueled by Nic Cage in his prime, gorgeous cars, an exceptional cast, and an unencumbered spirit that embraces the cheese. Gone in 60 Seconds immerses its viewers in a world of moral thieves with deep bonds and a strong code. As the movie progresses, discovering more about each character raises the stakes as the audience fears what could happen to these endearing bandits. Even though the plot has plenty of cheese, it’s balanced by the excellent execution and commitment of the cast. Peak Nic Cage makes the whole film sublime and delightful."
9679,Gone in Sixty Seconds,8.0,"Before there was fast the furious, there was gone in 60 seconds. Stealing cars in less the 60 seconds with Anglina Jolie by his side."
9681,Casanova,4.0,Childish in concepts and a little bit ideological. I like the costumes and atmosphere.
9689,Hollywood Ending,7.0,"Classical Woody Allen movie, script and performance. Funny at times, but not one of the best ones."
9691,Assassins,4.0,"A not great movie, but one that it's hard to pinpoint exact ways in which it could easily have been improved. A Stallone/Banderas as cat and mouse assassins sounds promising, but in reality this technoir thriller is... Actually kind of boring. Seems like it needs a ground-up re-working to get a story up to the concept of that team, which sounds exhausting.

_Final rating:★★ - Had some things that appeal to me, but a poor finished product._"
9693,Children of Men,6.0,"A strong premise and great cast prompted my interest, but the movie falls short of its promise. Clive Owens gives a great performance and a few of the scenes are remarkably memorable and resonant. However, there are very long stretches where the movie simply stagnates and the plot drifts away, especially towards the end. Overall, it's rather melancholy and despite the ""action"" scenes, not especially thrilling. If you like sci-fi movies set in dystopian futures, or are a big Clive Owen fan, you may still find it worth watching despite its flaws.

An aside: One of the ""extras"" on the DVD has some heavily accented academic trilling at length about the movie's philosophical meaning. It's entertainingly over-the-top and almost unintelligible: jargon piled into a Dagwood sandwich of contradictory abstractions. Anyway, if you don't watch too much of it, its good for a laugh."
9693,Children of Men,10.0,"Cuaron's masterpiece so far (including Gravity, which was gravely miscast). This film is: a) easily the best film of the decade of the 2000's; b) the finest dystopia film since 'A Clockwork Orange' and probably the best sci-fi since '2001: A Space Odyssey'; and c) all the evidence you need that Clive Owen should have been selected as James Bond in place of Daniel Craig. Heartily recommended to anyone interested in how great both science fiction and cinema can possibly be. You may be depressed with the state of both the world and mankind, after watching it, but you won't be disappointed in the possibilities of cinema."
9693,Children of Men,7.0,"One of the bleakest, most magnificently crafted films of all time. The dialogue is one-of-a-kind in actually capturing realism."
9694,One Missed Call,8.0,"One of the more emotionally driven of the J-horror genre, One Missed Call is a well done film with some haunting images, which is a staple with these of course, and although I probably prefer The Grudge, still found this one engaging thanks to some fine performances, mainly Ko Shibasaki and Shin'ichi Tsutsumi. **3.75/5**"
9705,Swordfish,8.0,"One of my all-time favorite guilty pleasures has it all with a convoluted plot, insane Bay-like explosions, that orange-tinge the early aughts were known for (also see Gone in 60 Seconds) and John Travolta sporting a soul-patch. Saw this one in theaters back in 2001 and like to put it on very couple of years when I feel like relaxing. **4.0/5**"
9717,Shoot to Kill,10.0,"""Shoot to Kill"" makes extremely good use of some absolutely breathtaking outdoor locations. It is also a very well paced and totally engaging film throughout and it features an admittedly heart stopping stunt that will literally take your breath away when Knox falls from a rope suspended over a picturesque and deadly gorge after he has been struck by the trolley used to transport people  across the head spinning and nausea-inducing gulf. There are also a wide range of wilderness survival tips and tracking techniques employed which help to place you in Poitier's predicament and it leaves you feeling as lost as he so obviously is when these necessary techniques come into play. It also teaches us the valuable lesson that if we were ever stranded in the unforgiving wilderness we would be incredibly lucky to survive for five seconds."
9722,Bewitched,6.0,Not a bad movie. The movie would've sucked if it weren't for Will Ferrell. He made the movie funny and decent.
9725,Friday the 13th Part 2,6.0,"_Friday the 13th_ creators couldn't have known what they were about to unleash in the now-infamous Jason Voorhees, and even though _Part 2_ is certainly not the strongest example of the character, it was the first time we got to really see him do his thing, and that's huge.

_Final rating:★★★ - I liked it. Would personally recommend you give it a go._"
9725,Friday the 13th Part 2,8.0,"Since I already watched the first film last month, decided in celebration of the day, re-watched Part 2 and still highly entertaining though pretty tame by today's standards. Thought the cast was also a bit better than the first. Still has scenes that make little sense (how exactly did Jason find Alice?) but was fun nevertheless. **3.75/5**"
