movie_id,movie_title,rating,review
5055,Ashes and Diamonds,8.0,"There are so many great things about how this movie is made - the directing, the shots, the tonal quality, and the pacing. Probably most brilliant of all is how the total makes the viewer feel claustophobic. I admit, though, it's a tad dated."
5055,Ashes and Diamonds,8.0,"There are so many great things about how this movie is made - the directing, the shots, the tonal quality, and the pacing. Probably most brilliant of all is how the total makes the viewer feel claustrophobic. I admit, though, it's a tad dated."
5055,Ashes and Diamonds,7.0,"My first Wajda and I really enjoyed it. I thought that Cybulski's performance was great and I loved the scene in the pub where he's lighting vodka shots, which he plays perfectly. The shots of him through the patterned staircase looked amazing in black and white, and especially because of his sunglasses. I did get a bit lost in the politics side of the plot but despite that I didn't get bored and I really liked the romance plot line and the sequence with the drunk secretary. I thought the blood coming through the sheet at the end was a really strong image and the final shot of him running through that kind of wasteland area was a great ending 3.5/5"
5082,La compagna di viaggio,,"This Italian erotic comedy from director Ferdinando Baldi takes place almost entirely on a train! 
Sexual tensions erupt in tight quarters and the female cast tries unsuccessfully to remain clothed in this rare European drool-fest. 
And what a cast!! Annie Belle, Anna Maria Rizzoli, Marisa Mell, 
Marina Hedman(Marina Frajese) and Moana Pozzi (Anna Maria Pozzi) 
all have their turns at shedding their clothes; however, it’s 
newcomer Serena Grandi (making her second film appearance) who 
steals the show as a young soon-to-be-wed virgin who finds herself 
in a compromising situation with the wrong man."
5121,The Sugarland Express,6.0,"Steven Spielberg's first proper cinema movie has some great photography from Vilmos Zsigmond.

The tone is uncertain. A road movie, a tragic comedy with car pile ups that is based on true facts.

Lou Jean Sparrow Poplin (Goldie Hawn) takes her husband Clovis (William Atherton) out of a minimum security prison just weeks before his eventual release.

All to save their child who has been taken away and ready to put up for adoption. They kidnap a police officer which leads to them being pursued by the police and the media.

Goldie Hawn is spiky as Lou Jean but she is also stupidly impulsive.

A story that needed more work, Spielberg does make an accomplished film."
5156,Bicycle Thieves,7.0,"When in Rome... keep an eye on your bicycle! Or else it might be stolen and you'll find yourself fruitlessly searching the streets of Italy, as the father and son do in this classic Italian film.  Lamberto Maggiorani, as the desperate, out of work father, and Enzo Staiola, as his frustrated young son, play off each other nicely and a nice pace keeps things interesting. It's heralded as one of the greatest movies ever made, but personally I don't quite see why. It's a good story none the less, and it kept my attention. There's a very satisfying dose of irony at the end."
5174,Rush Hour 3,2.0,"Arguably works as an example of the sort of red flags one might want to look out for if they suspect that a film's director is (like Brett Ratner) a sex offender.

But as a movie? Nah, not so much.

_Final rating:★ - Of no value. Avoid at all costs._"
5175,Rush Hour 2,4.0,"Didn't know I had a favourite _Rush Hour_ movie until today. I guess I do, and it's this one. Still pretty crap though.

_Final rating:★★ - Definitely not for me, but I sort of get the appeal._"
5175,Rush Hour 2,1.0,"OK, for those of you who, like me, liked Rush Hour, do yourselves a favor and stay away from this.

What we have here is basically Lethal Weapon 4 set in Hong Kong rather than LA. And... it just doesn't work.

Everything (save the stars) that made the first one funny is kind of out of place and forgotten. It's horrible. The fish out of water scenario fits well in Rush Hour, but set in Hong Kong, Tucker comes across as obnoxious instead of funny.

It's horrible."
5176,3:10 to Yuma,10.0,"Most of the time I hate remakes....but I give a big pass to most Western and War movie remakes.

Mainly that's because, until M*A*S*H early war movies had soldiers that looked like they stepped out of the shower and put on a freshly laundered uniform...you know, instead of the realities of life in combat zones.

And the same goes with Westerns, the cowpokes may be riding the range...yet they look like they had the time to shower, shave, style their hair, and press their clothes.

None of that really sat right with me...at all.

The remake righted that wrong.

And it did it without killing the wonderful Elmore Leonard story the movie was based on and let's be honest, he really has the best ideas for crime and western stories the world has ever seen."
5176,3:10 to Yuma,7.0,"First off this film is a remake of the 1957 film of the same name.

Casting couldn't have been better for the main characters. The R rating and amount of violence was perfect for the tone of the film. The ending was exactly what the film needed. Not some soft, heroes win feeling most films carry nowadays. One of my favorite films."
5178,The Good Heart,,"Brian Cox is excellent! As the characters transition and grow during the movie, you will laugh and cry."
5236,Kiss Kiss Bang Bang,7.0,"Funny story, tailored for Robert Downey Jr. with a superlative Michelle Monaghan. Val Kilmer shines like in movies some years ago."
5236,Kiss Kiss Bang Bang,8.0,"Probably the best thing Shane Black's ever made, and I do not say that lightly, even the worst things he's behind have been okay, and the great (like _Kiss Kiss Bang Bang_) are truly great. The movie that turned me on to lead man Robert Downey Jr., but it's Val Kilmer that steals the show here.

_Final rating:★★★★ - Very strong appeal. A personal favourite._"
5236,Kiss Kiss Bang Bang,10.0,"Awesome movie, if you liked The Nice Guys (2016) you're going to love this."
5236,Kiss Kiss Bang Bang,6.0,"**Kiss Kiss Bang Bang’s excellent acting, script, and writing are held back by its annoying and avoidable language and nudity.**

Kiss Kiss Bang Bang is a clever and unique mystery movie with brilliant writing, dialogue, and acting weighed down by unnecessary and excessive language and nudity. Seriously, I would love this movie if you cut out all the f-bombs and nakedness. Robert Downey Jr. basically auditions for Iron Man with his manic and witty performance, and his unlikely friendship with Val Kilmer’s character is highly entertaining and hilarious. Characters break the fourth wall several times throughout, keeping the movie comical and fresh. I really wanted to like this movie more, but the crass language and needless nudity hold Kiss Kiss Bang Bang back from being a holiday regular."
5255,The Polar Express,10.0,"No matter how many times I watch this, it always brought me to tears!

I only wish that I got to see it in 3D at the cinema."
5257,The Dish,8.0,"I may have watched this Aussie film much closer to when it came out, since 	 have always like Sam Neill, but I had no memory of it and we gave it a look. It is very entertaining in a quiet way. The bursts of humor are short, occasional and subtle, and it works.

Of course it is based on actual events and feature a few news archive clips as well as actors playing historical characters, sometimes almost as a cameo.

It features some restrained tension and suspense as the crew at the telescope try to live up to their commitment to passing audio and video from the moon landing on to NASA and the world. Among the supporting cast we also have a radical political daughter and a clumsy young couple trying to initiate a new romance. It all adds flavor to the main plot."
5259,The Band's Visit,7.0,"Some touching moments and a few amusing ones. Less than 90 minute film went by quickly, I wish the ending had been longer.Ronit Elkabetz is ravishing. Uneven but overall pretty good film."
5279,Gosford Park,6.0,"6/10 Good acting and a solid plot for a murder mystery, but has at least 20-30 minutes of scenes that could have been trimmed, esp as it takes 90min for the murder to occur.  I had figured out the key points and was falling asleep at the end...I'm still tired now, writing this."
5336,"Salò, or the 120 Days of Sodom",7.0,"Wow! You can't escape the fact that this movie pushes the limits of disturbing art! Many will call it sick. I suspect the point of this film is more about the depravity and dehumanization of fascism, political corruption, totalitarianism, and morality. I have not read the Marquis de Sade's work on which this film was based.

**It isn't possible to ""un-see"" a film, so be prepared if you choose the experience.** It was described to me as ""horror"" before I watched it, and I'm not sure it truly captures the film's genre. I can't think of a film genre that adequately describes it.

I will probably never watch it again or forget the images it seared on my brain. But I was challenged to think about various political and societal themes that are still very relevant today."
5375,Fred Claus,4.0,"Decent watch at best, probably won't watch again, but can recommend for off-brand holiday movies.

While I like watching Vince Vaughn beat up Santa Claus as much as the next person, I'm not a big Vince Vaughn fan.  I'd rather see what Paul Giamotti can do with the Santa role, honestly.

Kevin Spacey, being very much himself, is awful, or his character is, and a story needs a good villain.  Being a whiny spoiled kid in an adult body doesn't really do it for me, especially in a Santa setting."
5458,Cruel Intentions 2,5.0,No where close to being as good as the first. Seemed liked they tried way to hard to make it like and better then the first. They failed miserably.
5460,Cruel Intentions 3,5.0,Not that bad of a movie. No relation whatsoever to the others. They just mess with couples lives and feelings. They are pretty cruel.
5471,Beowulf & Grendel,5.0,"Not a bad little piece, but sort of out of its time. If it wasn't for the cast (and what a cast) I would have assumed this movie was made at least a decade earlier than it actually was. The dialogue's mix of contemporary and faux medieval was also particularly odd, and the effects were... I don't want to say bad... But, again, seems like the sort of quality that might have come about in the early 90s more than mid 00s.

_Final rating:★★½ - Had a lot that appealed to me, didn’t quite work as a whole._"
5492,Gunner,3.0,"""Gunner"" has a lot of flaws, including questionable music choices, iffy CGI effects, and reliance on typical action film tropes. However, it still delivers an old-school black ops thriller. Luke Hemsworth shines as the action hero. That being said, only watch if you have 90 min of your time to waste ..."
5492,Gunner,6.0,"It was quite decent movie. Had some flaws with weird music that didn't fit the movie and not very realistic scenes few times, but overall I enjoyed watching it."
5506,The Ladykillers,9.0,"A film of real quality!

<em>'The Ladykillers'</em> is amusing viewing. It's style of comedy is very fitting of its era, but I only mean that positively as the slapstick is undoubtedly fun to watch unfold. The cast are all worthy of a mention, though the standouts for me are Alec Guinness, Herbert Lom and Katie Johnson. The flick looks splendid too, love the set of Wilberforce's home.

Entertainment from start to finish, ya can't ask for more than that."
5511,Le Samouraï,,"Amazing movie! Withstood the test of times. Was watching it with a great interest unlike many movies of this era. Delon is magnifique! Unexpected plot and ending, but the title should have prepared me for it."
5548,RoboCop,8.0,"Ahhh, 1987, what a year for cinema. Not the least of which is Paul Verhoeven's incredible feat of practical effects engineering: _RoboCop_. This is one of those older movies where I can totally confirm for you, my love for it is in no way rooted in nostalgia. I didn't watch _RoboCop_ for the first time until 2013, when I was starting up my third decade of life. It's a phenomenal example of the period, but its also a great movie on its own.

_Final rating:★★★★ - Very strong appeal. A personal favourite._"
5548,RoboCop,9.0,"Seen this several times over the years and still holds up well, story and satire wise, though certainly some of the effects were dated (in particular the death of one character falling out a window). Other than that, an entertaining and bloody 1980s action-thriller, where the sequels and a remake, and certainly the third entry, could not touch. Would like to think the proposed RoboCop Returns will succeed where other failed, but don't hold out much hope. **4.25/5**"
5549,RoboCop 2,6.0,"It's not so much that it's terrible, it's just that it's disappointing after the immeasurable success of the original movie.

_Final rating:★★★ - I liked it. Would personally recommend you give it a go._"
5549,RoboCop 2,9.0,"The first thing anyone can say about this movie, and should say, is that it isn't RoboCop. But that should be said for all reviews for all movies always. Yet, this is still one of the best sequels ever put together to any movie anywhere at any time. Weller is outstanding again. How can stuffing a man into a foam latex suit and have him clip clop around in front of a camera work so well? Its mind blowing."
5550,RoboCop 3,4.0,"_RoboCop 2_ might pale in comparison to the original, but _RoboCop 3_ is the sequel that's genuinely bad.

_Final rating:★★ - Had some things that appeal to me, but a poor finished product._"
5550,RoboCop 3,4.0,"This certainly is not RoboCop and its not even RoboCop2, its, sad to say, RoboCop3. An embarrassment for everyone involved. It is the same level of failure as the third Mad Max movie, where he goes off to play with kids in the desert and then Tina Turner does a little dance or something. He has a jet pack in this one, idiotic. Fourteen thumbs down."
5551,Space Cowboys,7.0,"Something just doesn't quite feel right about <em>'Space Cowboys'</em>.

It's good, but it always feels like it's stuck in second gear to me. I was anticipating more based on the cast, but even they are a little underwhelming. it's relative to what I was expecting, as Eastwood is still solid, Tommy Lee Jones and Donald Sutherland too, and the plot is satisfactory; even if I would've shaved off 15-25 minutes. An interesting piece of casting, btw, is the film debut of one Jon Hamm.

Borderline forgettable, but nothing bad. It narrowly gets a 3* rating from yours truly."
5590,Donkey Skin,9.0,"A beautiful and stunning work, from both the acting primes of Catherine Deneuve, Jean Marais and Delphine Seyrig, and the directorial prime of Jacques Demy. One of the most exquisite and memorable transfers of a children's fable to the big screen."
5595,Fermat's Room,7.0,"Fermat's Room is a Spanish language film (set in Spain) in the same genre of films as the Cube series. A small group of people end up stuck in a shrinking room and the only way to avoid being crushed is to answer a series of riddles.

This movie is a fine example of one of my favorite movie types; characters end up stuck somewhere not knowing who put them there or how to get out but without the gore of the Saw series. It's well acted. It's well worth watching."
5636,Treasure of Silver Lake,6.0,"If it were not for the terrible dubbing and the overpowering score that sounded more suitable for a ""Tarzan"" film, this would actually have made quite decent western. Lex Barker and his ""magic silver stick"" with his blood brother Apache ""Winnetou"" (Pierre Brice) have some quite exciting escapades as they try to thwart Herbert Lom (""The Colonel"") and his seemingly never-ending army of men who are on the search for the eponymous treasure. It's a colourful adventure story with plenty of gunfights, a mini siege and, of course, plenty of rough and tumble. Made for the German market, which explains the rather quirky inclusion of a German aristocratic butterfly hunter, it has some a rather stilted, almost academic, script; it lacks vernacular and that can render it ridiculous at times, but it's still a decent effort from a nation not known for exploration into the Wild West."
5680,Elvira: Mistress of the Dark,6.0,"Elvira: Mistress of the Dark is a hilariously campy comedy that doesn’t take itself seriously, and that’s what makes it so much fun. Cassandra Peterson shines as Elvira, delivering sharp one-liners and an unapologetically bold performance that carries the film.

The story of Elvira shaking up a small conservative town is filled with outrageous humor, cheesy effects, and a good-hearted message about staying true to yourself. It’s silly, self-aware, and endlessly entertaining. Perfect for anyone looking for a lighthearted, laugh-out-loud good time."
5689,The Blue Lagoon,5.0,"The film starts out with a pretty good plot and storyline, but as the film continues, it just seems to drag on. It needed to move at a quicker pace, or modify the storyline to keep the watchers attention and interest. I’ve seen it all the way through once(1x), after that I always leave the movie 50-75% complete. 

> **RATING: _2.5_ / 5**"
5698,The Great Train Robbery,6.0,"Firstly, I feel honoured to be the first to write a review for this prestigious short; secondly, I found it to be… good. I can’t claim any more than that, though it is heavily influential. The narrative is unlike many other short, silent films as it actually sucks you in until that fantastic final shot. But was it perfection? No. Is it worth watching? Of course, I’m sure any of my fellow cinephiles can waste ten minutes for this cinematic curio."
5825,National Lampoon's Christmas Vacation,7.0,"<em>'National Lampoon's Christmas Vacation'</em>, unlike predecessor <em>'National Lampoon’s European Vacation'</em>, is more akin to the original. A good watch it is, if still off from the first flick. The festive vibes are there, it's perhaps a bit too mean-spirited at times but overall works.

The cast are the cast, I don't think anyone stands out as being a great performer but they are all satisfactory. Chevy Chase is the obvious lead, don't get me wrong, but I wouldn't rank his performance as anything overly higher than his co-stars. Interesting to see Julia Louis-Dreyfus appear, by the way.

All in all, there's enough there to entertain. The ending is suitably watchable, which is something I did feel was missing from the previous film."
5852,Angel Eyes,4.0,"Movie was good. Kept me interested throughout the movie, but the ending was dumb. It ruined the whole movie."
5910,Fireworks,7.0,"There's greatness in there, for sure, but <em>'Fireworks'</em> (or, the better title, <em>'Hana-bi'</em>) drags on for too long.

I was with it for the first 45-55 minutes, but the final portion of the film really dragged for me; aside from a few moments, it kinda just repeats the same sorta scenes over and over. Like, personally, I got it... needed a bit more to it, in my opinion.

There are some very good performances, no doubt. Takeshi Kitano is the obvious star of the show, though I was also impressed by Ren Osugi - who is just as excellent as the aforementioned writer, producer and director of this 1997 flick. The support cast are solid, while everything onscreen looks neat too.

I did like this overall, but I can't say it hit me as much as it evidently has for others. Worth a watch, either way."
5924,Papillon,9.0,"Although present for much of the filming, author Henri Charriere didn't live to see the release of PAPILLON (1973), which was based on his allegedly autobiographical novel. The veracity of what he recounts has been questioned virtually since the books' release in 1969, and the film takes further liberties, leaving one to wonder if this adventure picture is more fiction than fact. What one doesn't have to wonder about, however, are the results achieved by an underrated director at the top of his craft; a bracing Jerry Goldsmith score; marvelous cinematography by Fred Koenekamp; and spot-on performances by Steve McQueen, Dustin Hoffman, and a stellar supporting cast which features some of the best character actors of the period."
6037,Murder by Death,4.0,"A playful parody chock full of casual cruelty, misogyny, ableism, and racism. There is sincerely funny stuff here, but you’ll need to sit through a _lot_ of junk to see it."
6037,Murder by Death,10.0,"A movie from a time when people were not so easily offended. Lots of fun humor and laughs to be had if you sit back and enjoy the movie for what it is, a comedy from the 70s."
6056,Lord Edgware Dies,6.0,"Austin Trevor dons his best Belgian accent as ""Hercule Poirot"", the famous detective here called in to investigate the fatal stabbing of the wealthy Lord Edgware (CV France). It doesn't take us long to discover that his wife (Jane Carr) was seeking a divorce so she could marry the ""Duke of Merton"" (Esme Percy) - could that be a motive? Well he and Scotland Yard's finest ""Inspector Japp"" (John Turnbull) must find out. It moves along nicely, this, and is fairly faithful to Agatha Christie's original story. Sure, Austin Trevor's persona takes a bit of getting used to and the style of the production is very stage bound, but it is still quite an engaging budget murder mystery, with some decent acting efforts that I quite enjoyed."
6073,The Mexican,9.0,"Silly entertainment!

<em>'The Mexican'</em> works as a comedy and works as an adventure road trip flick, so it evidently achieved what it set out to do. This 2001 release features a strong cast, as we get Brad Pitt and Julia Roberts together alongside James Gandolfini, J. K. Simmons and Gene Hackman. I enjoyed all five, especially the first three.

It's not a film to be taken overly serious, it's one to enjoy and I got a lot of enjoyment from it - credit to Gore Verbinski & Co. Recommended? Definitely!"
6073,The Mexican,9.0,"It’s been a while since I’ve seen this and maybe my tastes may have evolved but I recall liking it a lot and watching it a second time at one point. I was pleasantly surprised by James Gandolfini’s brave choice of his small role, after the tough gangster roles. I would watch it again just for that. I would recommend this move to anyone looking for a nice early 2000’s romantic comedy."
6114,Bram Stoker's Dracula,,"This Seductive, Thrilling, love story has some Bite! Based from the book and is a true masterpiece. Gary Oldman plays Dracula and simply makes this movie. His obsession with Winona Ryder characters is relentless and heart chilling. Don't worry Keanu Reeves doesn't ruin it, he actually did a great job. Anthony Hopkins plays the role of Dr. Van Helsing. We all know his story now thanks to Hugh Jackman. Some brief nudity and a HOT scene with Winona as she runs though the garden in her PJ's. Not only do I gave Bram Stoker's Dracula 5 stars, BUT I rate it in my Top 10 all-time. MUST SEE!"
6114,Bram Stoker's Dracula,8.0,"The script is an unevenly good adaptation of the novel. It resolves better Dracula's aims and motivations through the love story.  Also, it provides a more understandable glue to join the 4 men chasing Dracula from a XXth century point of view and removes unimportant characters having a more ""round"" story.

However, due to some changes certain parts are now incoherent since they were not properly adapted to the other changes. In addition, other parts are totally impossible to follow due to the amount of details only commented quickly along the movie.

Costumes and general artistic work is superb but it drives the movie to some extreme stravaganza that, in the case of the actors' performances make some parts of the movie completely overacted.

In any case, I think this is an iconic movie worth watching more than once."
6114,Bram Stoker's Dracula,9.0,"Although it certainly won't make you easily forget earlier interpretations of the seminal horrific character by Max Schreck, Bela Lugosi, Sir Christopher Lee or Klaus Kinski, Gary Oldman definitely finds a way under your skin. As well, the resoundingly sumptuous cinematography will sweep you off your feet--unless you're dead to begin with... =)"
6280,Junior,6.0,"Good watch, could watch again, and can recommend.

If for nothing else, then you should watch this because this is ""the movie where the guy is pregnant"", but I'm not sure we need a reboot: one is probably enough.

It helps that this is a good movie with a great cast.  I felt bad they made Danny Devito run so much, but Arnold is great as a pregnant man, and sometimes a woman, and Emma Thompson does a wonderful absent-minded professor.

It's a unique premise, it's a good premise, and for a comedy without lasers, aliens, or explosions, there is a lot of excitement.

Give it a watch, it's all about the execution that makes this one great."
6282,Coyote Ugly,8.0,"<em>'Coyote Ugly'</em> is solid cheese and I'm here for it. There's nothing all that noteworthy to say about this, you'll either enjoy it or you won't; I doubt there's much middle ground. For me, it works. It's well paced and well acted, the music is well chosen too - s/o LeAnn Rimes.

I'm pretty sure I've seen this before when I was younger, so long ago that I hadn't had it logged on here. I can't say I totally remembered it whilst watching, though many of the scenes did feel familiar and I recalled the main cast. Speaking of which, Piper Perabo is good as lead. Maria Bello, John Goodman and Adam Garcia are also solid.

Just discovered that this has the same director as Kangaroo Jack. David McNally really made these two classics and ducked out of the industry, what a rockstar."
