movie_id,movie_title,rating,review
7446,Tropic Thunder,8.0,"Still as funny as the first time I saw this, probably way back in 2008. Good send-up on war movies and just great comedic performances all around, but especially Robert Downey Jr. **3.75/5**"
7452,"The Cook, the Thief, His Wife & Her Lover",9.0,"Having previously watched Greenaway's 'Prospero's Books', basically from the same era, one definitely gets a sense of the auteur, of great visualizing prowess in the Welsh native. I adore watching Helen Mirren from ANY era, but particularly here, in between the young adulthood beauty she displayed in Michael Powell's 'Age of Consent', through the remarkably absurd and audacious 'Caligula', straight to the sophisticated and very dangerous gorgeousness displayed in 'The Comfort of Strangers'.

It's great to see any dude who's mean to a beautiful woman get their comeuppance (particularly the wealthy--it offers a sort of 'wish fulfillment' for the 99% of us), and the climax here is one of cinema's most articulate presentation of that phenomenon. It definitely made me wish to see the rest of both Greenaway's movies and of Mirren's performances. Well worth the acquired taste necessary for this sort of delicacy."
7453,The Hitchhiker's Guide to the Galaxy,,"Just read the Book, it's so much better. If you have read The Hitchhikers Guide to the Galaxy there is a series to read, get to it!"
7454,The Bunker,5.0,"Maybe not the strongest example of this sort of thing, but certainly a watchable entry into the ""Supernatural shit happens in an underground Nazi bunker"" subgenre which very clearly exists.

_Final rating:★★½ - Had a lot that appealed to me, didn’t quite work as a whole._"
7457,Alpha Dog,,"OK Timberlake fans and haters alike, Calm Down! Largely regarded as ""you know, that movie with Timberlake in it."" Alpha Dog was enjoyable. And Timberlake did a great job. He is definitely all grown up now. A strong supporting cast of Sharon Stone and Bruce Willis sure didn't hurt. I loved how the cast worked so good together. They were very believable. The movie did a great job of showing us just how crazy and out of control a simple misunderstanding can get. Hopeful Hollywood does force Ben Foster down our throat! Small doses please! NOTE: Alpha Dog has a lot of language in it."
7461,Vantage Point,7.0,"Decent if not also contrived quasi-political thriller (the politics of it is rather thin and safe, so neither side will be offended) with each segment were okay though the Forest Whitaker one was the most ridiculous. Also not sure if there was meant to be one with the news team, and Sigourney Weaver's talent was utterly wasted.

All that said, the stunt and car chase sequences in the final act was great and a good choice more or less having Dennis Quaid being the lead of the ensemble. This probably makes for a fine weekend viewing even if the pacing, that is the jumping from one POV to the other, never quite worked but still found it entertaining. **3.5/5**"
7485,Shooter,8.0,"All around solid action-thriller with Mark Wahlberg in his element. Luis Guzman served as a fun sidekick and Kate Mara is a stunner. Shame this didn't do better at the box office, would've liked to have a sequel instead of that USA Network TV show... **3.75/5**"
7485,Shooter,,"Excellent movie with major stars like Mark Wahlberg and Danny Glover. An expert marksman living in exile, is coaxed back into action after learning of a plot to kill the president. Now on the run after being double crossed by a shadow government operation. Have watched multiple times!"
7507,The Specialists,7.0,"Above average spaghetti. great cinematography and camerawork in the Italian Alps, refreshing change from the Tabernas Desert in Spain. Some plot elements don't work and the ending is too reminiscent of ""A Fistful of Dollars"" which lowers it to a 3.5 instead of 4. Gotta love ""El Diablo"" though!"
7516,Smokin' Aces,7.0,"I don't think I can tell you that _Smokin' Aces_ is **good**. But I have seen the movie on three seperate occasions in the past thirteen years, roughly evenly spread apart. And each time I have not only enjoyed it, I enjoyed it more than the last time. This movie is **very** dumb. But fast and fun and oh boy what a cast.

_Final rating:★★★½ - I really liked it. Would strongly recommend you give it your time._"
7516,Smokin' Aces,6.0,"Sometimes wild, sometimes confusing action-thriller that boasts a great cast, but in the end, this wasn't a Carnahan movie that really did it for me. **2.75/5**"
7551,Déjà Vu,7.0,"Pacing could've been better but still an effective sci-fi thriller thanks to Denzel Washington's charisma carrying over the finish line. Even though this was my third viewing, first time in at least a decade, my feelings and rating remains the same. **3.5/5**"
7551,Déjà Vu,8.0,"Déjà Vu is a compelling blend of science fiction and action, showcasing Denzel Washington's exceptional talent. His portrayal of ATF agent Doug Carlin is both engaging and nuanced, bringing depth to the character. The film's production is noteworthy, with director Tony Scott utilizing advanced visual effects to create a seamless narrative that explores complex themes of time and memory.

The cinematography by Paul Cameron effectively captures the vibrant essence of New Orleans, adding a rich backdrop to the unfolding mystery. Washington's subtle humor, particularly the quip about the ""seven dwarves,"" adds a light touch to the intense storyline. Jim Caviezel delivers a strong performance as the antagonist, contributing to the film's tension and depth.

Overall, Déjà Vu is a well-crafted film that combines innovative storytelling with strong performances, making it a memorable addition to the genre."
7552,Fun with Dick and Jane,6.0,Interesting movie. It's a shame that there's lives got ruined. This what they resorted to. Different type of roll to see Jim Carey in.
7553,Waiting...,8.0,"Great watch, will likely watch again, and do recommend.

Granted it's a little raunchy, but it should be somewhat relatable to everyone.

This joins a movies like ""Clerks"" (basically any Kevin Smith movie), and ""The Concessionaires Must Die"" for it's fantastic dialogue and interesting characters.  Even if they're not ""good"" characters, each character has their own little gimmick that this awesome cast brings to life.

Not everyone can be Ryan Reynolds, Justin Long, Anna Faris or Luis Guzmán, but it all comes down to each and everyone's stellar delivery with the multitude of stories happening on top of each other.

The movie is very funny with deep thoughts sewn into it, mostly life philosophy."
7555,Rambo,9.0,"Kick-ass action all around and although the story is on the basic side and has minimal character development for Rambo himself, just a bloody, albeit too much of it CGI'd, entertaining especially an action-fest finale. Amazing, especially being the fourth entry into the series."
7737,Resident Evil: Extinction,5.0,"I suppose a bit better than Apocalypse as it feels a bit more mainstreamed in the plot and action, still not great but some of the fight sequences were okay and has some semblance of interesting ideas and I still like Jovovich in the role even if she's not the strongest actress, but does have some screen presence in this sort of movie. Being so short, you don't get to know Ali Larter's character all that well and felt odd that Jill (Sienna Guillory) and Angie's (Sophie Vavasseur) absences weren't mentioned (that I can remember). **2.5/5**"
7737,Resident Evil: Extinction,8.0,"**Overall : The final horror-focused entry of the franchise with high stakes and some great new characters.**

The third movie in the Resident Evil franchise and the beginning slide into outright sci-fi action. Most of this entry focuses on survivors attempting to withstand the dangers of a zombie-filled apocalyptic desert. Unfortunately, umbrella’s experiments on Alice have results that sometimes become the focus and begin dragging the franchise further from survival horror. I enjoyed this entry with the addition of Claire Redfield from the games, the return of Carlos Olivera, and the hopelessness of the deadly sun-scorched wasteland continually claiming the lives of the struggling survivors. But Alice’s superpowers distract from the core of what makes this franchise great: surviving zombie horror."
7737,Resident Evil: Extinction,6.0,This one is kind of boring till you get to the end. They try to stop the umbrella company from infecting everyone in world. Also try to save Alice while being experienmented on.
7737,Resident Evil: Extinction,8.0,"Resident Evil: Extinction is a must-watch. The movie follows Alice as she navigates a desert wasteland, battling mutated zombies and discovering the shocking truth of Umbrella’s experiments. The action is relentless, the stakes keep rising, and by the end, Alice uncovers an army of her own clones, setting up an epic fight against Umbrella. With a gritty, Mad Max-style atmosphere, this film delivers on thrills and suspense. Highly recommended for fans of sci-fi and horror!"
7839,Wedding Daze,6.0,"Good watch, could watch again, and can recommend.

If you like either Jason Biggs or Isla Fisher, then this is a lot of that: a lot of abusive humor to Jason Biggs and a lot of Isla Fisher being quirky but pretty.

The premise of being married too soon combined with traumatic experiences is fun, and everyone in the cast is good, but it's only so good.

It's nice to see modern day fables though where communication is necessary for happiness."
7840,"10,000 BC",4.0,"""Epic"" in so much as Emmerich films always are, but that's not to be confused with ""good"". If you want to learn something true, or feel an emotion, look elsewhere. But if poking a mammoth with a stick is more your thing, you could probably handle _10,000 B.C._

_Final rating:★★ - Had some things that appeal to me, but a poor finished product._"
7913,Rang De Basanti,,"One of the best Bollywood movie of 2006. A must watch for Bollywood fans. The performances are top notch, the soundtrack is great, the visuals are iconic."
7980,The Lovely Bones,,"This was a very good movie.  I never heard of this movie so i was watching my tv,lazy day so i left this on  my tv and i was really interesting movie.   I will give a 9 out of 10"
7980,The Lovely Bones,,"Without the rape, from the book, the movie loses all potency and gravitas. In what universe is there a Pro-Harvey/childraping/murderer?"
8012,Get Shorty,1.0,"You know what, I really love Elmore Leonard, and a part of me feels that nearly any movie made from his works is going to come out as fresh, original, and worth watching.

This is the rare exception.

Here they took a classic Elmore Leonard plot and made it too Hollywood for its own good. And then they tried a bit hard to make it too much like a Pulp Fiction film, but with less bleak comedy and more slapstick comedy.

You still have Leonard's unique originality...but the story has been raped and what's left is trash."
8016,"Germany, Year Zero",9.0,"What an awful position the despicable Nazis left their descendants at the close of the Second World War. Rossellini has the perfect, objective, almost documentarian painterly hand in his depiction of this, and I have the feeling that only someone from one of the losing Axis countries, such as he, could so astutely and profoundly bring across such a feeling of loss and guilt that haunted these 'survivors'. A very sad film to watch, yet at the very same time necessary and healing. Clearly my favourite of his works, next to his magnificent 'The Flowers of St. Francis'."
8016,"Germany, Year Zero",7.0,"Edmund Moeschke (""Edmund"") is superb in this gritty and authentic looking post-war story of a young boy struggling, with his family, to make ends meet in Berlin after the fall of the Nazis. Scrounging, scrimping, scavenging - all to try and keep his ailing father and the rest of his family fed and warm. It is tightly cast and the scenarios - filmed just three years after the allies reduced much of the city to rubble are very poignant; the photography and sparing dialogue all lend well to the gently accumulating sense of desperation that culminates in tragedy. The children bring optimism and hope to the story - their innocence writ large as they embark on a new life for them as did the rest of Europe in 1948. Well worth a watch."
8043,Breakheart Pass,8.0,"Really solid western-thriller with Charles Bronson in his element as usual with movies like these. Features a nice supporting cast that includes Richard Crenna, Charles Durning, Ben Johnson and Jill Ireland. Just an all around entertaining film from beginning to end. **3.75/5**"
8051,Punch-Drunk Love,2.0,This has to be one of the dumbest and worse movies I have ever seen from Adam Sandler. I don't get this movie or what the point of it is at all. Watched it 3 times and it still makes no sense.
8054,The Imaginarium of Doctor Parnassus,7.0,"The fantasy element was great. I wish I could live in this fantasy world. It was exceptional and very wonderful. I watched the movie twice. The first time, I didn't understand the movie well and didn't like it. I did not know whether I liked the movie or not, but when I watched it again, I was fascinated and inspired by the wide imagination element that exists within the scenario.

The character of Lily Cole was amazing, she is incredibly beautiful and I have to show respect for Heath Ledger's performance and Tom Waits gave an amazing performance. Christopher Plummer stole the show with a controlled, professional performance

The animation element wasn't well managed, it could have been shown better the way it was."
8055,The Reader,4.0,"I didn't turn this movie off after the beautiful sex scenes only because two others were watching it with me. The mere fact that ""Germans"" were speaking English totally destroyed the whole ""suspend disbelief"" for me. This film is an awful rendition by Brits of an award-winning German book. Perhaps, only someone from the Nachgeborenen (to coin Bertolt Brecht's meaning of German post-Holocaust generations) should have made this film. The two stars are for Winslet and Kross. The rest sucks."
8065,21,7.0,"**21 intrigues with a fascinating true story, fast pace, and fun characters.**

21 entertains with its fast-paced story based on the real-life account of the MIT Blackjack Team, who tried their hand at counting cards in Vegas and won big. While 21 is not groundbreaking in its storytelling or execution, it's a fun and enjoyable film with a good twist and likable characters. This film sets itself apart from a typical heist movie in that card counting is not technically illegal. The characters weren't trying to escape police but casino enforcers with brass knuckles and examples to make. This relatively unknown cast surprised with its solid performances boosted by the film's great pacing and exciting story."
8068,Desperado,9.0,"This was a solid and highly enjoyable take on the spaghetti western by Rodriguez that rightfully put the director on the map and provided star Antonio Banderas the breakthrough he needed in the American marketplace. Though I love his work on the Sin City films, particularly the first, his incredible earlier trilogy will always hold a special place in my cinephilic heart.

My recent project of coming to terms with classic Westerns has only further helped me enjoy these more recent contemporary releases."
8069,Barbarella,6.0,"Got the new Arrow Video 4K release and decided to give this another watch. Still not great but lots of fun to watch and of course Jane Fonda was sexy as hell. Wouldn't mind seeing the novel getting another adaptation, I can see someone like Edgar Wright giving it a shot (perhaps with Ana de Armas in the lead). **3.0/5**"
8077,Alien³,6.0,"Aliens, a great action movie, cheapened the original by replacing one hyper-intelligent, indestructible monster with an army of gormless critters. This third entry has only one creature, but unfortunately it's just as gormless. When Ripley (Weaver) crash-lands on a prison planet full of hard-nut slap-heads, they haven't seen a woman in years. Discovering that there's an alien loose, Ripley asks the warden to break out the guns, and can't believe it when she is told there aren't any. Nor can we. Good acting has salvaged many a poor script in the past, but not here. Dance is slaughtered in the first act, as is the regulation bastard warden (Glover), leaving only Sigourney, impressive as ever, and a motley cast of extras. Though wasteful of the expensive sets, Fincher's tight close-ups do add to the sense of claustrophobic panic."
8077,Alien³,9.0,"**Superior in every department to the basic shoot em up, Aliens,** 

Alien 3 returns the franchise to its artistic horror roots established by Ridley Scott. No more Disney kids, happy endings and machine gun wielding irritants.

This movie is a beautifully bleak experience and is the true sequel to Alien (1979). Performances are excellent all round - especially Charles Dance as prison doctor, Clemens, and, of course, Sigourney Weaver - who gives us her best performance as the downtrodden Ripley.

A masterwork by David Fincher that restores the horror and dignity to the series. Thank goodness for Alien 3! 

- Charles Dance"
8077,Alien³,7.0,"Did Gordon Ramsay direct this? F-bombs galore!

Sigourney Weaver remains a joy to watch, while Charles S. Dutton and Charles Dance are strong additions; Dutton especially. As for other positives, I enjoyed the score and the fact that we (seemed to) get way more of the alien itself; which is what I wanted from the first two, personally.

The plot isn't the greatest but is very watchable, the ending is pretty good. One criticism I do have is the dialogue, as alluded to at the top of my review. I've nothing against the use of swear words whatsoever, but man does this film overuse the f-word; it feels like every other word across the conclusion.

Overall, it's a definite drop down from the two very good predecessors, though I still got the required entertainment from <em>'Alien³'</em>. A noteworthy directorial film debut for David Fincher."
8078,Alien Resurrection,5.0,"A pretty average movie, specially compared to the previous installments in the Alien franchise (even Alien 3). The plot sometimes gets very confusing and none of the characters are memorable. Some of them are even rather cartoonish. The movie seems like a cheat attempt at cash crab, by using a known franchise. I would recommend watching if you are a fan or are looking for a mediocre action/horror movie to watch with friends."
8078,Alien Resurrection,8.0,"Super fun!

I wasn't expecting <em>'Alien Resurrection'</em> to come out better than <em>'Alien³'</em>. Sure, this 1997 flick isn't as great as <em>'Alien'</em> and <em>'Aliens'</em> but I honestly wouldn't put it that far off. I really enjoyed it, cracking action coupled with a great cast.

Sigourney Weaver as Ellen Ripley is a pleasure as always, meanwhile this is the most I enjoyed a support cast from the franchise. Winona Ryder, Ron Perlman, Brad Dourif, Raymond Cruz, Gary Dourdan and Michael Wincott all have positive moments.

Not the franchise's best, yet arguably its most entertaining. ¯\_(ツ)_/¯"
8080,Suspect Zero,4.0,"Don't remember when I last saw this, but probably was when it was released on DVD. So this is my second viewing and don't remember a whole lot but my rating pretty remained the same. It's unnecessarily confusing but worse, rather dull for the bulk with good actors like Aaron Eckhart and Ben Kingsley not being able to breathe life into boring script. Had potential perhaps under a more experienced director but as it is, this is one I won't revisit for a third time... **2.0/5**"
8090,Untraceable,,"A terrible movie that is full of cruelty. The problem of cyber crime is never relevant in our time. This cannot but scare. I am glad that I am using the Utopia P2P application, which allows me to keep my data safe."
8130,Desperately Seeking Susan,10.0,I always thought this was one of Madonna's best film performance yet.
8193,Napoleon Dynamite,6.0,"Original, unique, bizarre, hilarious!

* I love all the whacky and authentic and heartwarming characters from this movie.
* I think it has a kind of bedroom pop vibe to it. Alot of bedroom pop music videos look and feel similar with the fashion and ideas they riff on. 
* I love the environment they're in. Wide open, sparse midwestern town. The American landscape is big and cool.
* This movie is a brilliant example that art doesn't need a huge budget to transcend mediocrity."
8195,Ronin,5.0,"**A little boring with a great car chase scene.**

Even though Ronin had shootouts, great chase sequences, and classic actors, I was bored and on my phone throughout the whole thing. Nothing was particularly bad about this film. There were actually great parts! But somehow, the sum of all its parts just equaled a movie that left me wanting. Releasing four years after Leon: The Professional, this could have been much better."
8197,Midnight in the Garden of Good and Evil,8.0,"More enjoyable than I would've predicted.

I was expecting something more mysterious and thrilling, but <em>'Midnight in the Garden of Good and Evil'</em> manages to entertain nicely - despite a long run time, which I thought was going to hamper it but it didn't.

The cast are excellent. I really enjoyed John Cusack's performance and Kevin Spacey plays these sorta roles well. The Lady Chablis is another strong performer, while there are roles for a younger Jude Law, Clint Eastwood - the director - regular Geoffrey Lewis and, though very tiny, an on the brink of stardom James Gandolfini.

Well worth a watch!"
8202,Æon Flux,5.0,"Not really that good of a movie, but it's action packed tho. Some of the fight scenes are pretty awesome."
8202,Æon Flux,4.0,"I didn't watch this movie before I bought it on its release day. But I'm a big Charlize Theron fan, so it was bound to be good. I'm a big sci-fi fan, so I was bound to like it. I like movies that are a little different, so it was bound to be worth watching. Oh man, when I'm wrong I'm WRONG!"
8224,8MM,5.0,"8MM probably only got greenlit due to the success of Se7en. Like Se7en, 8MM explores the existence of people who are simply pure evil while the main character wants to know why they are like this. 8MM doesn't provide many answers but it also isn't thematically complex. It follows a standard whodunit plot. While Nicolas Cage gives a solid performance, there are times where he takes us out of the story with his signature freak outs. Joel Schumacher manages to create a gritty tone but he has a rather bland style.

Regardless of its flaws, 8MM is still a decent movie. It prefers plot over exploitation and story over violence. For those reasons, I recommend it."
8224,8MM,6.0,"Another one of Nicholas Cage's crazy movies. Like all the rest of his movies, this one was good too."
8273,American Wedding,10.0,My favorite movie from the whole series. I just kept cracking up non stop throughout. Still whenever I watch it I can't stop laughing.
8274,American Pie Presents: Band Camp,7.0,I thought this would be dumb compared to the original. It's not as good still but really funny.
8274,American Pie Presents: Band Camp,1.0,"The little brother of the character Stifler from the theatrical films goes to band camp, wreaking havoc and causing mayhem, because the film makers decided you're too stupid to require laughs from your comedy. This may be one of the worst ""comedies"" I have ever seen, and I sat through ""Beer for My Horses."" I hated all the characters, the story is predictable, and the lead character is a borderline sociopath who never should have had an entire film resting on his adventures. Repulsive and sad, your level of enjoyment might depend on how funny you find the word ""stiff"" and all its incarnations.

(Unrated)- Some physical violence, strong profanity, strong female nudity, male nudity, sexual content, very strong sexual references, strong adult situations, alcohol use."
8275,American Pie Presents: The Naked Mile,7.0,This one is my favorite one out of the presents series. A lot of nudity for the pervs. That includes you too woman lol. Also lots of drinking and drugs. I wish all college party's were this fun when I use to party.
8277,American Pie Presents: Beta House,7.0,"More college partying and trying to bang chick's for the 1st time, is back again. The presents series is turning out not to be so sad."
8293,Howards End,8.0,"The script itself is not up the level of Remains of the Day, but then E.M.Forster is not Ishiguro (Never Let Me Go). Nevertheless E.M.Forster gives us a huge, complex story that holds our interest for the entire 142 minutes.

And the Ivory-Merchant team contributes a beautiful setpiece, complete with perfect cinematography, locations, costumes and a team of the finest actors in Britain. And two of the Redgrave family to play mother and daughter. The acting from everyone on screen is phenomenal!"
8329,[REC],8.0,"**REC is zombie horror brilliance!**

REC is one of the best found-footage and zombie movies ever made. The panic, chaos, and terror that grows and spreads through a small apartment building as residents fall one by one to a zombie plague is overwhelmingly suspenseful and believable. REC starts slow but exponentially builds into a bloodcurdling frenzy with horrified characters frantically struggling to survive. This low-budget horror film belongs in the hall of fame for creativity and genius in the genre. I saw the American remake, Quarantine, many years ago, which is very similar to this film, but REC edges Quarantine with originality and a franchise of 3 other films following it. Any zombie or horror fan needs to add this to their watchlist immediately!"
