Movie ID,Movie Title,Rating,Review
46979,Le Amiche,8.0,"This film is taken from one of Cesare Pavese's finest works. It's seen through the eyes of Clelia, a fashion designer who has left her native Rome to start a business in Turin. There she witnesses a suicide attempt by Rosetta, a woman whose life, and the lives of Momina and Nene will influence Clelia's greatly. Marriage, men and money are the chief elements of the plot. This is one of Antonioni's finest films, from the period before L'avventura when he was exploring the themes that would preoccupy him for his entire career."
46993,Madame Satã,4.0,"Honestly, it's unwatchable. Didn't see any real merit other than it was a cheap excuse for gay porn."
47126,Windy City Heat,8.0,"Pretty damn funny. There is a lot of people who question it's authenticity, but real or not, it's pretty funny. Bobcat turned out to be a pretty inventive writer/director, or whatever it is he does."
47340,Dead End Drive-In,6.0,"Starts by ticking you into thinking it's going to be one of the 47 million _Mad Max_ rip offs that was released around the same time, but quickly takes a left turn into ""poignant social commentary"". Keeps the punks though, so that's cool.

_Final rating:★★★ - I personally recommend you give it a go._"
47460,Daffy - The Commando,7.0,"A Nazi commander and his diminutive soldier ""Schultz"" are charged with protecting their spot on the line from encroaching commandos. ""Daffy"" is sent on just such an Allied mission and swiftly proceeds to make light work of their defences as he causes a bit of propagandist mayhem amongst his new, gullible, hosts before facing an whole mess of Messerschmidts! The wartime feel good message is clear as a bell, but it's delivered in a much more light-hearted, less jingoistic fashion and that's much more entertaining than many featuring this frenetic, non-stop, duck."
47582,Castle of Purity,8.0,"This is quite a brilliant fictional recreation of a true story that took place in the 50s. A man keeps his family locked in their house to protect the purity of his wife and 3 children. It's like watching a train wreck in very slow motion. For modern reference, it's somewhere between Black Swan and Dogtooth, although it predates both of those."
47837,The Fugitive Kind,6.0,"<em>'The Fugitive Kind'</em> is just a bit too slow for me, I almost did enjoy it mind you. Marlon Brando and Anna Magnani are the stars and I did buy into their relationship by the conclusion; which, by the way, goes from 0 to 60 real quick! It is a solid ending though.

What precedes just meanders a little too much, for my liking at least. There were periods where I was locked on to events onscreen, though the down moments were quite noticeable too, unfortunately, and when all is said and done the latter probably outweighs the former."
47931,Elite Squad: The Enemy Within,7.0,"This second part has a better plot than the previous one but, other than that, more violence without much sense."
47945,Daybreak,3.0,"**One of Cuba Gooding Jr's worst films, and I've seen most of them.** 

Dumb (and dull) plot, subpar acting (Cuba raises the bar slightly but his characters kind of comes and goes) other talents like Jon Seda and Omar Epps are wasted."
47957,Madman,5.0,"Saw this a while back and gave it a second shot with Vinegar Syndrome's 4K release and... my opinion remains the same. The kills are unspectacular and on the whole was pretty dull, as were the cardboard cutout characters. Not sure the timeline when it was filmed, but seems like a clear Friday the 13th clone. **2.25/5**"
48202,Creature from the Haunted Sea,5.0,"A decent early film by Corman, as he starts to learn his craft. Not an essential film by any stretch of the imagination, but worth a watch, either if you are an enthusiast of his works or of sci-fi from that era. Not worth purchasing--save your money for more important ventures, especially since you can watch it for free--and legally--at Internet Archive."
48259,Crimes of the Heart,8.0,"I haven't seen any Bruce Beresford films, except for the magnificent 'Black Robe', and I'm a huge fan of the four main actors, so it was a no-brainer that I would eventually watch this. I enjoyed it greatly, and if you can handle a quieter 80's women's picture, there's much to enjoy here. Definitely worth investigating for the cinephile with exquisite taste."
48303,Certified Copy,8.0,"Sweet movie about the living troubles of a 15 years long couple.

Juliette Binoche and William Shimell do a great performance."
48354,Lady in the Death House,5.0,"Lionel Atwill makes for quite a charismatic criminologist as he keeps this blackmail thriller moving along swiftly. He begins investigating the murder of a man so he can prevent the execution of a woman on death row, whom he believes has been wrongly convicted. To make matters worse, her fiancé is the executioner tasked with despatching her. The score is completely at odds with the pace of the film, but otherwise it's a suspenseful hour of drama. Just about worth watching."
48374,Piranha,5.0,"It's tough to commend any actual parts of the '95 remake of Piranha, but it's actually quite fun to group watch purely because it's so dated.

Final rating:★★½ - Had a lot that appealed to me, didn’t quite work as a whole."
48393,Kidnapped,7.0,"I thrilling and realistic movie that gets harder and harder to take.

Too unnecessarily violent at the end but hooking nonetheless."
48506,The Big Story,7.0,"They have even managed to include the dimple on his chin as this brief film shows us three iterations of an instantly recognisable Kirk Douglas bemoaning to his newspaper editor the fact that he never gets anywhere near the big stories. The editor (also him) irately tells him to wait his turn just as one of the more experiences journalists (him) turns up with the Marciano story he wanted to do! Frustrated, again. It's a simple but active pencil-drawn animation that I quite enjoyed as it captured his room pacing, facial expressions and general demeanour quite accurately."
48605,Conflict,6.0,"Interesting idea, but it wasn't done as well as it could have been. The inciting incident doesn't really make sense, and it's not clear what's happening during a lot of the action in the middle."
48650,Room in Rome,5.0,"Probably the worst movie I've watched from Julio Medem.

Room in Rome doesn't have such a powerful story. In spite of Medem's efforts in the script, it feels awkwardly artificial. The movie cutting is not good and the repetition of the same music is tiresome. Horrible, too, the opera singing dub lip done by Enrico Lo Verso. Not his fault but Medem's though.

Also, by far, the worst performance I've watched from Elena Anaya. Natasha Yarovenko is, probably, the only thing to save in this movie."
48670,The Chimp,9.0,"This was a very enjoyable romp in which Laurel and Hardy drive a circus into bankruptcy, are paid a flea circus and a chimp instead of their wages, and are endangered by a jealous hotel owner who just happens to get their chimp confused with his errant wife of the same name. Essential comedy from the 30's."
48671,County Hospital,9.0,"An excellent short film by Laurel and Hardy in which Stan visits Ollie, who happens to have a broken leg, and ends up destroying the hospital in the process. Clearly in the boys' peak period. A plus is Billy Gilbert, who was always one of their best villains, and a minus is obvious back projection, due to producer Hal Roach's financial instability at the time."
48755,Beau Hunks,9.0,This was hilarious--especially if you're a Jean Harlow fan. A really fun film for those of you who enjoy the comedic duo.
48756,Come Clean,9.0,"I honestly never thought a simple trip to the store to get ice cream could prove so chaotic, but this IS Laurel and Hardy we're talking about here, so anything is possible and very truly ensues."
48817,The Fixer Uppers,9.0,"One of the duo's last short films is another to cherish, as they portray greeting-card salesmen who are only too successful at helping a neglected wife get more attention from her husband by making him jealous. Some really fine work by the boys here."
48827,The Live Ghost,9.0,"Another fine short from the boys at their peak, this time stuck between a rock and a hard place, trying their best to avoid both an awful boss and a vindictive crew that they tricked into becoming fellow sailors. A fine supporting crew make this required viewing for comedy buffs of the period."
48830,Me and My Pal,9.0,"This was a hoot, as Ollie ends up late for his wedding because of a thoughtful gift from his best man, Stan--a jigsaw puzzle that EVERYONE becomes addicted to.

I'm especially fond of this film, and gave bonus marks to it, due to the fact that its release date was exactly 70 years before the birth of my son, Julian."
48871,Red: Werewolf Hunter,3.0,"Perhaps the avid Felicia Day fan might want to watch just for the ability to say that they watched a movie with Felicia Day in it. Otherwise it's pretty hard to see any value in this (definitely made for TV) movie.

_Final rating:★½: - Boring/disappointing. Avoid if possible._"
48890,Oliver the Eighth,9.0,"This was hilarious. It makes you understand, in an instant, why children reflexively scream when they're taken to get their hair cut for the first time, as well as why all the really smart people, like Pink Floyd in their heyday, always grew their hair so long. As well, it should make all prospective parents think twice before naming their sons Oliver."
48902,On the Wrong Trek,8.0,"Though predictable, this Charley Chase-featured comedy short, a bonus on my Laurel and Hardy boxed set (as it has a cameo of them), was a load of laughs. That'll teach Charley not to give them a lift!"
49008,Going Bye-Bye!,9.0,"This was pretty uproarious, as Laurel and Hardy have vengeance against them for sending a criminal up the river, then having the bad luck of bumping into his girlfriend on their way out of town. A fun short film from their peak period."
49009,The Way Back,7.0,"It is always a pleasure to watch one of Ed Harris movies.

The plot hooks you and the staging is impressive but the movie is not as thrilling as it could have been."
49013,Cars 2,4.0,"Lasseter is smart enough to tell us a completely different story than in the first movie. However, it is far from other titles like ""Toy Story"" or ""The Incredibles""."
49013,Cars 2,7.0,Not as God as the 1st just slightly though. I do think it's funnier then the 1st one. Diego just bothered the hell out of me for some reason.
49017,Dracula Untold,5.0,"FX, Evans and Dance's performances are the only things to save in this movie.

If you think Dracula becoming a hero and a martyr is a good idea, you will like it. Otherwise, like in my case, you will think that it was the worst idea in quite some time.

So, Dracula is not the most evil creature in the world any more ... :("
49018,Insidious,7.0,"It's not wholly original, but it works because the people involved **make** it work, first and foremost, James Wan.

_Final rating:★★★½ - I really liked it. Would strongly recommend you give it your time._"
49026,The Dark Knight Rises,9.5,"The Dark Knight Rises is one of the best movies to come out in 2012. The story compels you to watch it time and time again. It also has I of, I my opinion, the best bad guys in any movie, Bane! Batman was well played as all ways and the cast where well selected. I think this movie is the best batman to see the light of day or the darkest nights (pun intended)."
49026,The Dark Knight Rises,9.0,"Even though the plot feels messier than the previous two installments, one cannot resist a smile after the unexpected twist and final scenes, which make ‘The Dark Knight Rises’ a worthy final chapter of Nolan's epical trilogy.

9/10"
49026,The Dark Knight Rises,8.0,I enjoyed watching the Dark Knight. They were at least able to keep the same batman from the the last one made too.
49040,The Bourne Legacy,10.0,Arguably the best Bourne film to-date. The acting is top-notch and the plot is just awesome and believable. It starts out a little slower than the previous ones but then it picks up. I can't wait for the next one! Woohoo!
49046,All Quiet on the Western Front,9.0,"All Quiet on the Western Front is as beautiful and poetic as it is brutal and blunt. Historically accurate, emotional, and raw, this film is easily the best war drama to arrive since ""Saving Private Ryan"". Although available in English over dub, watching the film in the native German language with English subtitles is the way to go. Somehow, hearing German commanding officers shouting in English doesn't have the same dramatic effect. The cinematography is amazing. Go watch it."
49047,Gravity,9.0,"Great story, great cast and performances, great direction, FX, photography, care for the details, OST and editing.

Alfonso Cuarón is a real titan and Sandra Bullock goes for the Oscar.

It is not a 10 because at some point the chain of events goes further that it should."
49047,Gravity,9.0,"**A cinematography masterclass!**

The cinematography of this movie is a breathtaking feat, unlike anything I have ever seen! The commitment to realism influenced every decision throwing the audience into the intensity of every moment. An enthralling ride from beginning to end with overwhelming effects and masterful storytelling that makes you feel every second. This movie absolutely earned its place on the list of “1001 Movies to See Before You Die.”"
49047,Gravity,8.0,"Gravity is an epic thrill ride that starts and never ends. I have not felt continued tension like this film in some time. The entire movie is so isolated and desperate, it is incredibly immersive. It had me on the edge of my seat the entire time. The script is a bit rough at times, a large portion of the dialogue does not seem realistic and can come off as corny sometimes, especially with George Clooney's character. Overall, it is short, face paced, and thrilling and I would highly recommend.

Score: 82%
Verdict: Great"
49049,Dredd,9.0,"This film blow me away! I was not expecting this, a cop (a judge) based in the future with high violent's and great characters. You will think you will hate Dredd but you wont."
49049,Dredd,4.0,"So, nothing new under the sun. The same boring story and characters mixed in another movie. The only thing remarkable in this movie is the slow motion used during the drug usage, which is not much to say."
49051,The Hobbit: An Unexpected Journey,9.0,"An other great master peace has been added the the Lord of The Rings collection. This movie was an excellent example of how great actors, an amazing story and a beautiful world can be produced in such an excellent way. Peter Jackson has out done his self by creating this great film. There are differences from the book but I can't complain about any of them, yes I love the original story but this one is still one of the best. All in all a amazing movie."
49087,Moss,7.0,"You really can't beat the Koreans for unraveling a mysterious crime bit by bit, in the style of a dripping water torture. Sure, they could've done this movie with 40% less film, but it's still eminently watchable and enjoyable."
49114,$30,8.0,"Teenage Scott (Erik MacArthur) is presented with thirty dollar teen prostitute Emily (Sara Gilbert) on his birthday, and she figures out why he is not interested in her. The final film is also a good effort, with MacArthur and Gilbert scoring major indie film points, and they have a really nice chemistry. Emily's character is not delved into much, because this is not her story. Cooke's direction is fine, if not a bit awkward here and there, and Christopher Landon's script is smart- watch for the inside joke concerning Emily's choice of TV viewing habits. A solid entry."
49118,Majorettes in Space,8.0,"From France, this mockumentary ties in one heterosexual couple, one gay man, the production of condoms, the Pope, and the obvious fact that when a Cosmonaut calls his wife a ""fat cow,"" he is using a metaphor. This is a very fast and freaky collection of images, and it not only works, but makes some kind of sense. Fourier is making a statement about AIDS and protecting oneself sexually, but he does not take his point and belabor it."
49158,Tentacles,3.0,Yawn-enducing Jaws rip-off that is so dull with card-board characters with actors who could not car less and clearly there for a quick paycheck. This is one of those creature features that could've been the so bad it's good variety but instead is forgettable. **1.75/5**
49396,The Haunted,8.0,"OMG, I remember watching this movie around the time of it's release. I had nightmares for weeks after. Perhaps now showing its age a little, but overall a good story, and made all the more terrifying as it is based on a true story. 
It is so hard to find a Truly good Horror movie and in my opinion, this doesn't dissapoint."
49397,Death Rides a Horse,9.0,"This was excellent. My son's 13th birthday, and I treated myself afterwards to a really fun and engaging Spaghetti Western."
49444,Kung Fu Panda 2,7.0,"Threre are few sequels that are better than the original. This is one of them.

Smarter, with good plot and an amazing animation. Perfect for a movie session with the family."
49502,So Evil My Love,7.0,"Pretty good gothic thriller with everything from deceit, blackmail and ultimately murder. Liked the two leads with Ray Milland and Ann Todd, the latter's character being manipulated from innocent widow to a woman committing ever escalating crimes. Pretty tense film from beginning to end. **3.75/5**"
49519,The Croods,10.0,"Love this movie. I find myself coming back to this one over and over. Great animation, cool creatures, fun story."
49521,Man of Steel,9.0,"When I first saw the trailer, I was a little excited.

Man of Steel is the first of many films of what would now be known as DCEU. 

Zack Snyder did a really brilliant job directing this movie - it was amazing! Henry Cavill was superb as Superman and Michael Shannon was brilliant as Zod. And a hat tip to Russell Crowe's performance.

The best superhero film in 2013."
49521,Man of Steel,8.0,"Reading other reviews, I can understand how people that grew up with the comics didn't like it.  I never grew up with the comics.  I thoroughly enjoyed this movie.  It gets a lot of hate.  I thought the story, pacing, acting, and special effects were all excellent.  The scene where he learns to fly is one of the greatest scenes in modern cinema, in my opinion.  Gives me goosebumps every time."
49524,R.I.P.D.,6.0,"Yes, ok, it's a terrible film, but in the best way. It's worth watching just to see Jeff Bridges having so much fun sending up his character and himself."
49529,John Carter,8.0,"Edgar Rice Burroughs wrote his series of John Carter novels before space flight was more than a fancy.  This movie is more adventure and romance and very little (if any) actual science.

This movie is the best production of A Princess of Mars, the first story in the series, that I've seen.

If you're a fan of the John Carter novels then you will probably get some enjoyment from John Carter.  While there are some differences you'll meet some familiar characters and recognize quite a few relevant plot points.

Not a great film, but not a bad one, either."
49530,In Time,9.0,"Fantasy of course, but the way technology is changing the face of this world, in 2021 it would not surprise me. Action packed from start to finish, with many 'on the edge of your seat' moments. Worth my time and I highly recommend it for anyone looking for roller coaster entertainment.⭐⭐⭐⭐⭐"
49530,In Time,10.0,Another one of my favorite movies. I've never seen a movie like this before. Imagine if you really did have a clock that tells you when your going to die.
49538,X-Men: First Class,9.0,"A very good movie!
I'm not a massive comic book reader/fan and when I watched the first couple of the X-men movies I always wondered how it all begin and this movie do it justice! The actors where great (there no Patrick Stewart or Ian McKellen), Kevin Bacon played the baddie very well and was well suited for it and it was graphically impressive.
Loved to see the development of the characters over the duration of the film.
In all, I think it was a excellent movie."
49730,Red Riding Hood,6.0,"Hardwicke clones Twilight style on every way in this movie: photography, editing, dialogues, disconnected story telling and even the looks of the male hero.

However, the script is interesting and keeps you hooked on not knowing what's going on until the end."
49786,Shadows on the Stairs,6.0,"For anyone who watches the Basil Rathbone/Nigel Bruce ""Sherlock Holmes"" series of films, you will recognise almost all of the cast from this afternoon feature about guests in a boarding house who find themselves amidst a set of curious murders. It's all run-of the mill stuff but a decent enough adaptation of Frank Vosper's (himself, quite an interesting figure) play ""Murder on the Second Floor""."
49787,The Reef,6.0,"I can't say that The Reef is a perfect, realistic shark movie but it comes very close. It is also the first one I have seen so far where humans are bare in the water and not supported by a boat (Jaws (1975)) or a cage (47 Meters Down (2017)), for instance. It keeps the suspense throughout, making you guess a shark entry here or a panic attack there. Decent performances by the cast and a swift screenplay, The Reef will make for a good late-night watch with the family. (Grade B-). TN."
49841,Sarah's Choice,10.0,Abortion is one of the worst crimes against humanity that anyone can ever commit. This movie is an excellent resource for anyone still on the fence about whether the taking of a helpless fetus is the right or wrong thing to do.⭐⭐⭐⭐⭐
49849,Cowboys & Aliens,5.0,"This is an interesting concept, unfortunately it's already been done. And there are so many tropes in this it's hard to appreciate anything... except for Olivia Wilde and Sam Rockwell. They can stay."
49983,Enemy Gold,5.0,"Kind of by-the-numbers film from Andy Sidaris (though he only produced, son Drew directed) using much of the same cast and locales. A few good-bad moments and Julie Strain is beautiful (horrible acting even by Sidaris standards, however), but nothing really stands out. **2.5/5**"
50014,The Help,9.0,"Great setting, cast, story and performances. A must to be seen."
50053,2010: Moby Dick,2.0,"This movie was so bad, it's worth watching it at least once..."
50108,Sars Wars: Bangkok Zombie Crisis,7.0,"It is just as goofy as one would expect a Thai-indie self-aware zombie spoof comedy to be. If you want serious acting and a solid storyline - go watch something else. If you want a laugh involving zombie babies, a CGI snake, and absurd situations - then this may be what you are looking for. :-)"
50117,We Were Strangers,8.0,"It was unique to come across this early Huston work. It's weird that today, three generations later, when Scarlett Johansson gets in trouble for being cast as an Asian, that this was long the practice. I've seen star Jennifer Jones here as a Cuban, and later in 'love is a Many-Splendored Thing' as Eurasian.

She and John Garfield (himself playing a Cuban-born American businessman and revolutionary supporter) had good chemistry, and the film was finely made. Worth purchasing and rewatching."
50124,Frivolous Lola,7.0,"This was hilarious and part of my three-film Tinto Brass Sex Comedies boxed set I received from my best friend Earl last year for my 46th birthday. I was moderately interested and enthused about the idea of this boxed set after adoring his hugely controversial swords-and-sandals epic, 'Caligula'. I watched this with my lady Tammy on a fine evening with two exceptional craft beers, which we split. Heartily recommended for adventurous couples to watch together! =)"
50125,AC/DC: Let There Be Rock,9.5,This is without doubt one of the absolute classics when it comes to live performance videos. Filmed at a smaller (by comparision of todays standards) venue with minimal lighting and effects. Also one of Bon's last performances with the band at its best in this era. A must see for all fans of Rock'n Roll.
50348,The Lincoln Lawyer,8.0,"Good thriller with a round script and a performance to suit Matthew McConaughey.

Nothing to object, just enjoy!"
50357,Apollo 18,9.0,"Close up, intense and extremely claustrophobic. It's the type of horror mockumentry that I love.

If you're not into old style blackbox film, don't watch it.
If you're the type to not watch slower intro sequences maybe skip this one."
50359,Hop,4.0,"Just feltlike the bunny was being mean to the human the whole movie. I guess it was supposed to be funny, but it just felt sad and upsetting. The whole movie just kinda fell flat."
50454,Christmas Angel,7.0,"Film/TV that made my mum cry: 
<em>'Prison Break' | </em><br>
<em>'The Whale' | </em><br>
🆕 <em>'Christmas Angel'.</em>

This is a festive movie with heart. I enjoyed it. Sure it has your usual made-for-television amateur-ness/nonsense and Xmas flick cheese, though I'd rank it higher than what is produced normally by these sorta filmmakers. Kari Hawker and K.C. Clyde are decent, though Bruce Davison is the clear standout - he makes the film, no doubt.

You can't really knock a movie with such a positive message, either."
50456,Hanna,10.0,"SAIRSE RONAN IS THE ONLY PERSON TO PLAY THIS COMPLEX LONELY YET POWERFUL CHARACTER. ONE OF THE MOST INTERESTING FEMALE ASSASINS EVER TO BE PUT INTO FILM. SO YOUNG, SO SCARY. HERIOC"
