Movie ID,Movie Title,Rating,Review
36631,Never Let Go,6.0,"I'm afraid that I struggled with this... Richard Todd is ""Cummings"", a cosmetic salesman under pressure at work and at home, who finds his woes compounded when his new car is stolen. Determined to keep his job, and to find his car, he soon finds himself embroiled in the petty criminal world of a really poorly cast Peter Sellars (""Meadows"") - who really hams the part up and looks like he ought to be selling Tiramisu somewhere. What ensues is a really rather lacklustre, soap-opera style, effort from all concerned including the charming, but under-used Elizabeth Sellars as wife ""Anne"", Adam Faith as the pretty but useless bovver-boy ""Tommy"" and David Lodge as the crook's right hand man who doesn't look like he could pull the skin off a custard. The drama and the pace are all too forced, we don't really understand what is driving Todd's character (well, I didn't anyway) - his amiable, gentle persona becomes someone implausibly readily all-too-handy with a monkey wrench before an ending that was pretty scratchy. It's got a decent look to it, to be fair, but it did nothing for me, sorry."
36643,The World Is Not Enough,6.0,"Love Brosnan as Bond but man was he straddled with a bad script and even worse casting with Denise Richards playing a nuclear scientist. I get pre-Craig Bonds always had a tongue-in-cheek streak to them and ridiculous scenes (the opening boat chase was laughable once it went to the street) but this was a bridge too far (only to be outdone in a scene in Die Another Day). That said, there are some decent action set pieces and Brosnan still has the charm. **3.0/5**"
36643,The World Is Not Enough,1.0,"This begins the total collapse of Bond films.
We have the usual formula of beautiful women and lots of action, but here the action is very unmotivated.
Bond finds himself a body guard to a spoiled beauty queen, and we figure out early that the real heroine is the more matter of fact educated woman.
That's fair enough.
Still, everything that happens just looks contrived to make it end a certain way, with as depressing an ending as is allowed. That's the Hollywood formula, to make the world depressing for young men, and that's all they set out to do in this movie."
36647,Blade,5.0,"Blade is tons of fun, particularly when viewed through the nostalgic lens of 90s action cinema. It's also worth noting that the success of this movie - an R rated vampire flick with an African American lead - gave birth to the comic book movie era. The action, effects, and music are silly and dated, plus the story makes no sense. But Blade is nevertheless still fun."
36647,Blade,7.0,"Some good fight scenes and like Snipes in the role (reminded me of a time when he was trying) and Stephen Dorff was an okay villain, plus it was a serviceable plot. However, and I know this was 1997/98 when it was made, but the CGI at the end took me out of it (hell, good CGI done today takes me out of these sorts of films). But all in all, found it entertaining enough. **3.75/5**"
36647,Blade,10.0,"When this came out I thought it was the best vampire movie ever. Tons of action, fight scenes, and gore. I love how the vampires look when they die. One of my favorites!"
36647,Blade,6.0,"Wesley Snipes is ""Blade"" - an immortal half-breed charged with protecting mankind from the menace of the ever-peckish vampires with only his quirky sidekick ""Whistler"" (Kris Kristofferson) as an ally. Finally, the vampire council decide it is time to rid themselves of their nemesis and so ""Deacon Frost"" (Stephen Dorff) is tasked with bringing him down. I was always a fan of Dorff - never the best actor, but he had a bit of presence on screen - a good looking bit of rough, I suppose - and here is is a good counterpoint to the fastidious man-in-black whom he is out to destroy. The fight scenes are too choreographed for me, way too much acrobatics that detract from the menace of the story - it's supposed by about vampires, not rhythmic gymnastics - but it still moves along well as ""Frost"" tries to summon the blood god ""La Magra"" to give him the ultimate power to defeat our hero. This doesn't hang about, the action is fast-paced and the effects and characterisations gel quite well together for an enjoyable, if predictable story that is by far the best of the sequels it spawned."
36647,Blade,7.0,"<em>'Blade'</em> is not entirely what I expected. I had no clue this was about vampires, like at all. I evidently knew little about these films, I was anticipating a relatively standard yet stylish superhero flick - based upon the lead character's look, which is the only thing I knew of.

That's not a criticism, as the vampire stuff ended up being pretty fun to watch unfold. I will say that Wesley Snipes is the reason for that fact though, as Stephen Dorff and his band of one-dimensional renegades are only just narrowly watchable. Snipes as the titular character is excellent though, while Kris Kristofferson and N'Bushe Wright are good too.

The special effects haven't aged the best, though some parts are still decent and, to be honest, even the less than good pieces still work. For example the effect used when the vampires are killed looks fine, though the end with Frost's blood does look a bit dorky now - but again, works."
36648,Blade: Trinity,4.0,"It might (barely) have gotten one more star if it hadn’t been the third one in the Blade trilogy. As such it has some mighty good movies to live up to and that it doesn’t.

This time David S Goyer took to both write and direct the movie. I guess he should have stuck to script writing or something. The action scenes are not too bad. However, that’s all there is. Just a string of actions scenes barely strung together.

The worst offence of them all is Dracula. When I first learned that they brought in Dracula as the chief nemesis I thought that sounded cool. Wrong! Apart from a fairly cool look when he get really pissed off the film’s portrayal of Dracula is a joke. It’s an insult to the Dracula legends.

To sum it up, it’s 2 hours of not too bad action but a disappointment as a Blade movie."
36648,Blade: Trinity,8.0,"After watching all 3 of the Blade movies in a row, it gives a lot of perspective. The first was before all the Marvel boxoffice stuff took off, the second was having some Reaper stuff which was cool, but Trinity was the best in the series for sure. It needs better writing as Snipes has attested. We can tone down the Deadpool a bit and have more Wesley being a badass and not trail off into side projects. Whistler's family origins type things as well as Hannibal King's, but focusing more on Blade because he seriously can carry the whole film like he should have been doing since day 1."
36648,Blade: Trinity,2.0,"When a horror movie has to resort to vampire dogs, you know they're completely out of ideas. That's the least stupid part of Blade Trinity."
36648,Blade: Trinity,4.0,"TRINITY is not a good movie, instead it is a solid ""Blade"" movie -- meaning, if you are not already a fan, don't bother. Snipes no longer plays Blade for humor, as he did in the first Blade"
36648,Blade: Trinity,8.0,All 3 Blade movies are awesome in my opinion. This one is my favorite out of the series. It introduced at the time a different type and kind of vampire. This is movie is freakin' awesome.
36648,Blade: Trinity,5.0,"""Blade"" (Wesley Snipes) is now alone - surrounded by enemies bent on his destruction. Then, as luck would have it, he meets up with the ""Nightstalkers"", led by former vampire ""Hannibal King"" (Ryan Reynolds) and ""Abigail"" (Jessica Biel) who might just have developed a virus that could rid the world of vampires forever. To combat this threat, the vampires raise their king ""Drake"" (Dominic Purcell) and the battle lines are drawn in the ultimate fight for survival. Snipes is OK as a our leather-clad, mean, moody, hero but actually doesn't seem to feature so much - most of the action is driven by Reynolds who, whilst initially quite sarcastic and witty, rather overplays his hand and soon becomes just a bit too attitudinal; and Biel who appears to be on remote-control for much of her efforts. Purcell makes for quite a decent baddie, as does Parker Posey as ""Danica Talos"", though at times you do wonder if you should be shouting ""boo, hiss"" at the telly. There is plenty of fast-paced action throughout, but all in all this is just one, really pretty derivative sequel too many."
36657,X-Men,7.0,"X-Men is a milestone in cinema history. Without it being actually good and such a smash success, we wouldn't be enjoying the comic book movie world that rules the box office today.

The approach of X-Men was the right one. It told a relevant human story about prejudice, treating the source material respectfully and seriously. It's legacy may be greater than the actual movie, but X-Men is x-cellent!"
36657,X-Men,8.0,"<em>'X-Men'</em> is very good.

Another franchise I'm checking out for the first time, despite knowing about it for a number of years. This is a positive opener, there is a lot to feel entertained by for sure. Hugh Jackman (Wolverine) is the star of the show, though Patrick Stewart (Professor X) and Ian McKellen (Magneto) are solid too.

Intrigued to check out the sequels and the subsequent other productions.

/copied directly from my Letterboxd review\"
36658,X2,7.0,"X2: X-Men United is an improvement over its predecessor in just about every way. Better story, better effects, better action, and more interesting mutants. It's the best of the original X-Men films and a high point for early 2000s comic book moviemaking. Worth watching for the Wolverine vs Lady Deathstrike fight alone."
36658,X2,6.0,"Good watch, might watch again, and can recommend.

Again, horrible ""comic book movie"", good stand alone movie.

Wolverine was the most interesting thing about the last movie, and this is a surprising instance of a studio realizing audience feedback and basically just made the first Wolverine origin movie, because that's what this is.

Comic continuity aside, and Wolverine aside, the war of the Brotherhood of Mutants is fairly compelling angle to take, and it is refreshing they did it from the human's side, but if you look at it closer, then we're just looking at another race war.  It sort of takes the fuel out of the fire when you realize how ""real"" your super power problem story is.

While this has a slightly better premise, and good plot skeleton, there is a lot of ""(mostly Wolverine does) something cool here"" stuff, but there are at least 2 large exceptions with multiple mutants working together that end up being a ""lot of cool stuff"", but also add some significance to the story and heavily progress the plot.

I'd honestly recommend anyone watch this over the original."
36658,X2,8.0,"Strong sequel.

I didn't quite enjoy <em>'X2'</em> as much as <em>'X-Men'</em>, though not by much in truth. This follow-up film is still something I'd class as entertaining. Hugh Jackman (Wolverine) again impresses, though those behind him are - though all good - a little meh in my opinion; especially newcomer Brian Cox (Stryker), who underwhelmed me.

All in all, it's a film that is totally worth watching and is a sequel that is worth its salt.

/copied directly from my Letterboxd review\"
36658,X2,9.0,"**X2 takes the X-Men far beyond the scope of the first movie with exciting new characters, manipulative villains, and bigger effects and stories.**

X2 forever stands as one of my favorite sequels of all time. It deepens its characters' backstories, expands the universe, increases the stakes, and creates new conflicts lasting beyond this franchise entry, promising more to come. The opening scene blew my mind when I first saw it and really showcased the power a single mutant could possess. The struggle between light and dark, both in humanity and mutants, was a theme throughout and highlighted in a multitude of ways. Exploring Wolverine's mysterious past and tying it into the overall conflict of the X-Men was a wise choice rather than having Logan search for answers alone. In addition, the women of the X-Men, Jean Grey and Storm, along with Mystique, saw more significant roles and character development. X2 was the Empire Strikes Back of the original X-Men trilogy- better in every way, with exciting new characters, threats, stories, and effects. X2 deserves a place as one of the greatest comic book movies and sequels of all time."
36668,X-Men: The Last Stand,7.0,"I'm surprised to see a big drop in average rating for this.

I enjoyed <em>'X-Men: The Last Stand'</em> to be honest. Taking a quick look at some other reviews and it seems to main gripe is how it treats certain characters from the comics, which is fair enough for sure but that doesn't come into play for me as I'm not a comic reader.

I can only judge it as a film and as one I found it suitably entertaining. Hugh Jackman remains the top dog, though at the beginning the way Wolverine acts felt off to me - though that quickly went away. I would've liked if they found a spot for Nightcrawler (Alan Cumming), though one of his replacements in Beast (Kelsey Grammer) went down well with me.

From what I read I can understand other people's complaints with this, especially with the aforementioned iffy character treatment, but I gotta be honest and say that I found it to be a good enough watch - even if it is comparatively the weakest entry of the original trilogy.

/copied directly from my Letterboxd review\"
36669,Die Another Day,8.0,"Most definitely the worst 'official' James Bond film I have ever seen (haven't seen 'The World Is Not Enough', 'Quantum of Solace' or 'Spectre' yet) but still has its moments, and like The Rolling Stones or Pink Floyd, even the bad stuff is better than 80% of the other stuff out there. Still I wish it wasn't Brosnan's last one--and though Craig was truly a refreshing change in his realistic tone that hearkened back to the great days of Connery, that too got old, even for the actor himself."
36669,Die Another Day,1.0,"This STANK.

The Fx were horrible for a Bond movie, especially one made in 2002... and that isn't even getting to the theme song yet. Madonna set the record for the all time worst Bond song in the history of Bond songs.

And she set the record for one of the all time worst Bond villains in franchise history.

It doesn't really feel like a Bond movie, it feels like a movie that was trying to make a mockery out of past Bond movies.

Nothing comes together, everything is just flat out horrible, and, in the end, you want it all to be over.

It's honestly worse than Moonraker"
36669,Die Another Day,7.0,"The last of the ""very good"" 007 films.
It isn't spectacular, but it works. 
There's intrigue, and lots of action, and the dynamics of the heroine-villainess and hero-villain are very good.
The ""gadgets"" are a bit sillier than usual, like the visible invisible car(?) but who cares?
The ""over the top"" action is always in every Bond film. Some films just don't try to lie about it. This one doesn't try to lie about it, so that also works.
This one has a lot of ""people aren't who they appear to be"", and there's a bit of detective work involved.
Still, it isn't a ""classic"" movie, but very watchable and entertaining, and very 007 with lots of action, scenery, women, and some attempts at wit, although wit is being crowded out in modern Bond films."
36669,Die Another Day,7.0,"You know how I said The World Is Not Enough was silly, that doesn't mean much if I like this."
36670,Never Say Never Again,1.0,"What were they thinking?
This stood for a while as the worst of the 007 series, although it's been outdone since then.
It's just too boring to be as Hollywood depressing as it tries to be.
Plot? You'll lose interest in the attempt to show a plot. It's a grand scheme to threaten the world, and Bond is there to save the day.
There's nothing wrong with Connery. It's the script. It's the direction. It's the monotony. It's the totally predictable Hollywood ideology.
It's a more ""Hollywood"" rendering of Thunderball. Here, we have it made for women. This is a chick flick 007 movie, with the heroine being the pale ""plain Jane"" that all women identify with. 
There is nothing memorable about this movie. You'll see that for yourself, if you watch it.
What were they thinking?"
36685,The Rocky Horror Picture Show,6.0,"I'm afraid to say that seeing this very recently on the big screen without an huge degree of audience participation showed the film up rather poorly for what is has has now become - tame! Barry Bostwick (""Brad"") and new wife Susan Sarandon (""Janet"") find themselves stranded in the kooky manor house of ""Dr. Frank N. Furter"" (the excellent Tim Curry) just as he is about to unveil his newest invention - the epitome of sexual perfection; every person's wet dream... ""Rocky Horror"" (Peter Hinwood). It doesn't take long for the corrupting influences to dazzle our naive newlyweds, and soon just about nothing is off limits. The superbly written, catchy songs are the stuff of movie legend, as it the marvellously camp contribution from Richard O'Brien (""Riff Raff"") but 45 years on, the innuendo-ridden script and gender-bending routines have lost almost all of their punch. As a cinema experience without good company, loads of noise, fishnets and red wine - it's all just a bit flat now."
36754,The Snorkel,6.0,"Right from the outset, we know what has happened to ""Mrs. Dexter"". We see the clever method by which she is gassed to death - but there is something a little bit ingenious about the fashion in which her husband ""Paul"" (Peter van Eyck) executes, quite literally, his wife. The police arrive, and finding the room locked and taped up assume quite naturally that she has taken her own life. Her daughter ""Candy"" (Mandy Miller) isn't buying it. For years she has been claiming that she saw him (her stepfather) kill her real father whilst boating, and now she is determined to get to the bottom of it all. What ensues isn't actually very good, nor is the rather underwhelming acting - but the last fifteen minutes presents us with a lovely sense of divine retribution that I thought salvaged the mediocrity of the rest of it rather well. It's a bit long, and way too wordy - but just stick around for the end and ask yourself what might you have done?"
36778,Spellbinder,8.0,"""Spellbinder"" draws most of its inspiration from the undisputed genre classic ""The Wicker Man"" (1973) and it manages to add a few extra touches of its own (the satanists making a blood sacrifice). It also draws some additional inspiration from Dennis Wheatley's classic ""The Devil Rides Out"" (1968) with the satanists relentlessly pursuing Miranda (Kelly Preston) after she has gone missing. However, this film also expertly misleads you throughout until the very end - the police arrive on the scene during the climatic action of the denouement, but not to arrest anyone. No, they are actually here to actively participate in the sacrifice of Jeff Mills (Timothy Daly) - and the director Janet Greek has done a splendid job and she has delivered a well paced and thoroughly engaging film."
36789,"Hook, Line and Sinker",5.0,"This starts off with Messrs. Wheeler and Woolsey nonchalantly riding their tandem when they are pulled over by a police officer. Moments later that have fast-talked their way into selling him insurance for just about everything and we are clued up for what to expect over the next 75 minutes. It turns out our two sweet-talkers could sell sand to the Saudis - and when they meet up with ""Mary"" (Dorothy Lee) who is on the run from her wealthy, overbearing, mother, they agree to help her run her ramshackle hotel that soon becomes a roaring success. That success is, however, based on a few false premisses -and that causes more that it's fair share of adventures and mis-haps. When it works, the partnership works well and it is funny and fast-paced, but it is far too long and after a while the comedy becomes wearisome and predictable."
36797,RocketMan,5.0,"I, somewhat weirdly, have no negative feelings about <em>'RocketMan'</em>. That's strange because the film is very bad, there is nothing I even marginally liked - and yet, I have no annoyance towards it. Odd.

I think what helps in that regard is the short run time and the fact that I do believe the actors were trying, they were just lumbered with a poor product. Harland Williams plays the role of Fred as well as anyone could have to be honest, while it's nice to see Jeffrey DeMunn - shoutout Dale, <em>'The Walking Dead'</em>.

The way the premise is brought to life is the biggest downside to this. It's cringe, predictable and lamely written. The more serious space ending is OK but doesn't fit the rest of the film's silliness at all. There aren't many, if any, laughs; for me at least. I did kinda rate the references to other films, e.g. <em>'Wizard of Oz'</em> and <em>'Pinocchio'</em>, but that's about it.

A harmless film, one I truly don't even have an ounce of hate for despite how bad it actually is."
36884,"No Retreat, No Surrender 3: Blood Brothers",9.0,Classic martial arts cheese from the 90s i adore this movie series and grew up watching these daily.. they dont make them like this anymore. Def needs a bluray or 4k upgrade.
36895,Suzaku,8.0,"I interpret this film as a slow, meditative thesis on the wabi-sabi of generational change. Like the fleeting cherry blossoms, the Japanese have reverence and respect for impermanence and imperfection. In the middle of the film, we heard an older man ask ""How will our young find someone to marry (if the railroad is not built)?"" Everyone is aware of the traditional village dissolving, yet only Kozo is unable to live with this. He disappears. Yasuyo moves away taking Machiko with her. Eisuke, who was, and still is, afraid of the ghosts in the tunnel (the past?) decides to remain in the village, perhaps only because the tradition of living with family still resides in him. We in the Western world do not seem to appreciate the trajectory of change in our own culture. Even viewed through the lens of our contemporary ADD, this film is good."
36923,Hot Boyz,7.0,"**Lowbudget rapsplotation flicks at it's finest.**

It's not ""good"" but it's entertaining, a No Limit Film (if you were into rap music in the late 90's you know about No Limit Records). 

Silkk The Shocker is a pretty terrible actor and he's got the lead but that is part of the what makes it entertaining.

Inspired by Scarface, Carlito's Way and those type of movies (albeit of course of lower quality).

Snoop Dogg and Master P are more background actors in this."
36929,Big Bully,6.0,"Good watch, could watch again, and can recommend.

I love getting in the ""way back machine"" and seeing Rick Moranis movies, and I'm not a big fan of Tom Arnold, but he nails this big dumb bully role.

There is a lot of establishing information, and they work really hard to express a parallel in parents vs children and projecting a ""break the cycle"" morale on the story, but most of the movie is just Tom being a jerk to Rick.  It's almost a Tom and Jerry movie.

I honestly spent a lot of the movie trying understand why Tom wasn't under arrest.

It's not the best movie, but it's reliably good.

If you're feeling an urge for a late 90's movie and this looks interesting, give it a shot."
36939,Boogie Woogie,4.0,"Bad watch, probably won't watch again, and can't recommend.

There are so many good actors in this movie, and I watched it specifically because it was a movie with Amanda Seyfried about which I hadn't heard.  I understand that it had a point (sort of), but it did feel like there was somewhat unnecessary fan service with her and Heather Graham, and they are unfortunate highlights of the movie.

This is all about the ""art world"", which means it's not about art, the quality / value of at all: it's all about capitalism, so it becomes an business / politics movie.  It's all about these people we don't know or care about diddling each other and trying to out extort each other.

It would be more interesting if it was a nature documentary.

Watching rich people shuffle money about for no reason just isn't interesting to me.

And if I never hear Danny Huston laugh like that again, then my life will be better."
36940,The First Beautiful Thing,8.0,"Good comedy/drama about a dysfunctional Italian family and the memories of the eldest son.

Nice story, well told."
36947,Manufacturing Consent: Noam Chomsky and the Media,10.0,"We have gone from Noam Chomsky, who famously said that you can only have one or two positions on free speech....to a left wing that wants to censor anything remotely offensive to them.

The left has gone from this wise old sage to spray painting ""Liberals get the bullet too"" at protests they are countering to squash free speech.

And its gotten to the point where Margaret Atwood had her feminist credentials stripped away, Howard Zinn passed away, anything that is disagreed with is labeled as hate speech...and anyone you disagree with is a Nazi that needs to be hit.

The old guard has died and a new insanity has taken its place.

We need Noam Chomsky back, we need his politics to return. We need that level-headed reason to come back into the left. Because, clearly, when we stop listening to people like him we open ourselves up for people like Stalin.

You need to watch this film, you need to pay attention to it, because right now the left is doing it wrong."
