Movie ID,Movie Title,Rating,Review
84577,7 Below,2.0,"Luke Goss, you gotta stop putting me through crap like this man, please just be in another good movie!

_7 Below_ is bad, and it's the kind of bad that really can't be excused or overlooked. The awful sound mixing alone would disqualify it from being any sort of worthwhile, but that is merely where _7 Below's_ problems begin, not where they end. Please do yourself the favour of avoiding this movie like the plague.

_Final rating:★ - Of no value. Avoid at all costs._"
84708,Captive Wild Woman,5.0,"Middling 1940s horror movie with John Carradine playing a mad scientist converting an ape into a woman. Could've made for a cheesy entertaining film that I couldn't enjoy with the clear animal abuse; fine for the times I know, but was at times hard to watch. **2.5/5**"
84892,The Perks of Being a Wallflower,8.0,"Really complex and sweet movie with a great story, script and performances from Lerman, Watson and Miller.

Also, great directing and cut. A really good movie for a rainy day."
84892,The Perks of Being a Wallflower,10.0,This movie was godly. No other like it. Truly a spiritual experience.
84892,The Perks of Being a Wallflower,10.0,"This movie & book honest to god changed my life. I also feel that they supplement each other well. The movie includes details not included in the book and vice versa. Read the book and then watch the movie, its a spiritual experience."
85001,Blood Tracks,3.0,"Pretty lackluster indie horror film with shoddy acting though some of the gore effects were okay I guess. Heavy influence from The Hills Have Eyes as well, just set in a snowy environment instead of the desert. Watchable but just a bad B-movie, but I wonder if it'd be entertaining in a group setting. **1.75/5**"
85087,Dreams of Dust,7.0,"Powerful if brutal film about shame,guilt and redemption. Even when one has lost everything and has nothing. Great cinematography."
85110,Dog Star Man: Part I,8.0,"I adored this, quite reasonably regarded as one of the finest post-silent short experimental works. Confused why it's regarded as five separate films, though.

Seen on my university library's Criterion Collection DVD of Brakhage's anthology, Volume 1. I certainly hope to purchase for my own collection the blu release of Volumes 1 and 2."
85148,Terror at Tenkiller,3.0,"Sleep-inducing horror-thriller that lacks any mystery since the killer's identity is shown in the opening scene. Some okay gore effects at least given the budget. Still, even though it's only 88-minutes, feels so much longer as the bulk of the film was filled with boring dialogue and bad acting. **1.75/5**"
85194,Deadly Games,3.0,"Starts off well enough with decent suspense and kill (not to mention gratuitous nudity in a day for night shot no less) but the rest of the film was pretty boring, not to mention some annoying characters and bad acting. Despite being fairly short, I found most of this to be rather dull and a twist that wasn't very effective. No wonder this early 80s slasher had been forgotten. **1.25/5**"
85199,Death Screams,4.0,"Low budget and rather dull 1980s-slasher where 60-70% was filler and a sequence that Red Letter Media would call ""shooting the radio"" where we spend a chunk of time at a county fair. None of the characters are memorable but at least the last 15 minutes had a silly fun vibe, just not nearly enough to make this at all entertaining. **2.0/5**"
85207,Airborne,4.0,"I'll watch anything that provides me with a little Craig Conway, but _Airborne_ never elevates itself above the micro-budget Brit horror movie that it is. The acting is certainly not quite so bad as might expect, but the film overall is still not something worthwhile by-and-large.

_Final rating:★★ - Had some things that appeal to me, but a poor finished product._"
85435,A Few Best Men,1.0,"Wretched comedy about English boy preparing to marry an Aussie girl. His pals make the journey Down Under to proceed to make the wedding into a disaster. Crude jokes and situations, often involving a ram. Debicki’s debut and Wilson’s second film. Newton-John looks false and enjoys cocaine."
85595,Account Rendered,6.0,"This is quite a gripping little crime B-feature. When a rather odious woman is murdered, there is no lack of suspects for Ewen Solon (""Insp. Marshall"") to investigate. It could be the husband, the lover, the artist - or just about anyone. Griffith Jones (""Ainsworth"") and Honor Blackman (""Sarah"") help this tightly paced/scripted drama move along a-pace with just enough suspense to keep it interesting for just under an hour with quite an exciting conclusion in the dark with some noisy steam trains raising the tension nicely."
85889,Filth,7.0,"A movie with a difficult story and interesting plot. A gift for the cast and a McAvoy who performs great.

Don't watch it if you don't have a deep skin and tons of sense of humor since it is quite disturbing but enjoyable at times ...

Quite an example of the humor in UK but not just that ..."
86001,Pain,7.0,I felt bipolar with this movie. It will make you laugh and cry.  The script is not amazing and the story is very simple. Not pretentious at all but it really touched me.
86251,Strike Commando,5.0,"Rip-off (or if being kind, homage) of Rambo has some hilariously bad moments and while parts were a slog to get through, but I had some fun watching especially the over-the-top acting and action (get a chuckle every time a grenade is thrown, baddies would fly back several feet even though the explosion was nowhere near them). The lead, Reb Brown, doesn't have a whole lot of charisma but fine for this kind of material. **2.5/5**"
86254,Crash Landing,4.0,"It's story isn't bad (although it's full of clichés) and it does have some likable characters but it's budget, script, and acting (in particular Brianne Davis) are all pretty awful."
86302,A Lovely Way to Die,4.0,"This comedic-thriller is neither funny nor very suspense-filled. The dialogue is stilted and characters not entirely likable, but worse it's just all around dull, uninteresting and forgettable. By the end my mind was drifting off elsewhere. **2.0/5**"
86326,Phantom of the Mall: Eric's Revenge,5.0,"Has a couple moments and decent kills, especially during the finale, but otherwise pretty bland 1980s horror take of Phantom of the Opera. I did like the lead (Kari Whitman) well enough (though thought her friend, played by Kimer Sissons was cuter) and can't say I was terribly bored, yet doubt I have any interest revisiting. Kind of blends in with most of the horror films that came out of the 80s. **2.5/5**"
86515,Savage Sisters,5.0,"Watchable but kind of bland 1970s action flick featuring 3 cute leading ladies who were mostly unremarkable in terms of screen presence. Parts had okay action but I found stretches that were pretty lackluster, even dull. On the plus side, Sid Haig was having a good old time so he was a lot of fun whenever on screen. **2.75/5**"
86682,They Call Me Macho Woman,5.0,"Watchable but also repetitive horror-thriller finds our heroine running, getting captured by drug dealers, escaping, captured once again and escaping, and yet again captured before escaping one last time. This goes on for a good hour of an already short movie. The last 15-minutes or so was entertaining enough but the rest is a bit of a chore to sit through. The whole premise makes no sense as to why they wanted to keep her alive. Debra Sweaney was attractive at least. **2.25/5**"
86726,Under the Boardwalk: The Monopoly Story,10.0,"This film should appeal to everyone. For history buffs, the largely unknown but amazing early history of Monopoly is uncovered. For gamer types, the latest round of national championships around the world and the World Championship in Las Vegas add the right amount of suspense. For pop culturists, the game's many icons and famous sayings are surveyed through great movie and tv show clips. And for those wanting to win when they play Monopoly, the included strategy tips are sure to help. Seems like great fun for everybody!"
86786,Action U.S.A.,6.0,"Outside of some fun pyrotechnics (explosions), this is a pretty bland action movie with no real chemistry between the three main actors. Seems like this was going for a Lethal Weapon vibe (which was released two years prior in 1987), but never reaches that level, not even close. I guess has some bad-good moments but I was fairly bored through much of this. **2.75/5**"
86812,Sound of My Voice,10.0,"Excellent movie. It's very interesting. Doesn't have any dull moments. Creates something unique atmosphere. After watching it, I had a desire to watch it again. All Actors are playing well their roles, characters aren't boring. Ending is surprisingly interesting. I think it became one of my favorite movies of all time & I admit, I love well-made indie movies like this. And definitely I'm recommending this movie for the people who seek movies about cults, people's life & mystery, instead of special effects & etc."
86828,Absolutely Anything,4.0,"A better cast, worst scripted _Bruce Almighty_. The execution is severely lacking, and as much as I adore seeing Simon Pegg and Kate Beckinsale ham up the screen, it seems obvious how much better this could (and should) have gone. What we are left with in _Absolutely Anything_ is a movie that was engaging, yet glaringly bad, the sort of thing I didn't hate watching, but will never watch again.

_Final rating:★★ - Had some things that appeal to me, but a poor finished product._"
86837,Amour,8.0,"Superb drama about the final stage of the life of a middle-high class couple in France when one of them gets disabled due to a stroke.

Bothe actors perform exceptionally."
86889,Dracula,10.0,"There was no shortage of vampire movies in the early 1970s, so it's
understandable how this gem became a bit lost in the shuffle. In this
sadly underrated version, Jack Palance's interpretation of the Count is
both powerful and frightening under the skilled direction of Dan Curtis.
A great script from legendary horror / sci-fi veteran Richard Matheson
adds much to the value as well. The film has solid production values
and a standout performance from Nigel Davenport as Van Helsing."
86955,Body and Soul,8.0,"I love silent films, though this one heralding the first film performance of Paul Robeson is simply good or decent, not great or essential. Robeson's performance is excellent in an otherwise average melodrama, and it's clear he's going to be a star of the silver screen. In her only cinematic appearance, Julia Theresa Russell, who was the director's sister-in-law, deserves mention, however. She's gorgeous and her acting wasn't bad at all. The jazz/blues/spiritual score on the Criterion Collection release, I believe by Wycliffe Gordon, is outstanding. Recommended if you like either silent films or Paul Robeson."
87421,Riddick,8.0,"The third Pitch Black film ""Riddick"" is much more focused than its predecessor and a welcome return to the formula that worked so well for the original movie. Riddick is a bad-ass survivalist fighting an extinction level event that threatens everybody, with an assembly cast that is colorful and fun to watch."
87502,Flight,8.0,"With Robert Zemekis at the helm, it has to be good, right?

Pretty much. Not the strongest performance by Cheadle, but otherwise the cast is great. John Goodman is a welcome surprise half-way through and really brings this home.

With a feel good ending, what more do you 1-3 star people want??

It's Denzel!!"
87827,Life of Pi,9.0,"Visually, this movie traps yourself from the beginning to the end.

The story is really deep and moving and the performances are plainly good.

A must to be seen."
87827,Life of Pi,9.0,"Perfectly written, amazingly filmed, and surprisingly ended. Definitely, going in my amnisa list."
87874,Werewolf,3.0,"Just... Just unapologetically awful from start to finish. But has one of the best reasons for a person to become a werewolf ever put to screen: The bloke gets absolutely brained by a werewolf skull in the first act.

_Final rating:★½: - Boring/disappointing. Avoid where possible._"
88174,Whispers in the Dark,6.0,"Some okay moments and the acting from Annabella Sciorra was pretty good, though the ending has a couple unintentionally funny parts, one with the killer just blurting out a confession (sure, he was cornered with Sciorra's character discovering his feelings for her, but was just odd and felt lazy), followed by him expositioning all the things he did throughout the film. Still, as 1990s erotic thrillers go, it's watchable. **3.0/5**"
88273,A Royal Affair,8.0,"Based on a true story, this is a phenomenal period piece with first-class photography, directing and acting. You can't ask much more of any film. Pure, historical entertainment."
88947,A Stranger in Town,7.0,"Tony Anthony as The Stranger in an above average spaghetti. Frank Wolff as Aguilar was best behind a machine gun. Some good scenes Great ending. So little dialogue, the music seems almost non-stop as a filler. The main theme is OK, parts of the 'score' are truly crap and distracts from enjoying the film to an extent."
89125,Alley Cat,5.0,"Oddly paced revenge thriller has a couple okay fight scenes from the lovely Karin Mani but there's no real stand-out moments and as a whole, pretty forgettable. **2.75/5**"
89455,360,4.0,"Somehow boring movie of crossing lives. Fernando Meirelles is not as successful as with City of God. This movie looks like bad a remix from Iñarritu's and Arriaga's ""Amores perros"", ""21 grams"" or ""Babel""."
89652,Colt 38 Special Squad,6.0,"A bit slow at times and a pretty basic plot, but this Italian crime-thriller has its moments and I liked the lead well enough to keep following, but nothing really memorable. **3.0/5**"
89720,Kiss of the Tarantula,4.0,In a nutshell - a girl in a backwater American town uses her deadly pets - tarantulas - as her instrument of vengeance on any who piss her off. That includes just about everyone except dear old dad (who makes/sells coffins!). It's pretty variable drive-in fayre though the ending did inject a tiny bit of suspense for a few minutes.
89921,White Fire,4.0,"While there were a few good bad moments early on, the rest was either really dull or downright creepy with an incestuous relationship between Bo Donnelly (Robert Ginty) and Olga who gets plastic surgery to look like his sister who was killed, and the pair have some sort of romance going. Beyond that, the plot gets really muddled by the finale to the point I had no idea, nor had much interest, with what was happening. **2.0/5**"
90015,Bandidos,8.0,"Really good western with solid performances, but it's the direction from Massimo Dallamano (DP on A Fistful of Dollars and For a Few Dollars More) was top notch and some great angles and perspectives. So far in the ""Vengeance Trails"" set, this is my favorite. **4.0/5**"
90110,Down and Dirty Duck,8.5,"I only recently saw this great film on DVD and I must say, its one of the best films of its kind! We follow Willard, an insurance adjuster who finds himself on one crazy adventure after another with one crazy duck. The music is great, the jokes (while dated) are very funny,and while the animation quality may not be as good as many of Ralph Bakshi's films, I found this far more entertaining than Fritz the Cat. Its a must see for those who love the more twisted films of the 70's."
91550,Violet & Daisy,8.0,SAIRSE RONANA AND ALEXI BLEDEL OWN THE SCREEN AND THOSE WHO HAVE DONE THEM WRONG.  THE SCRIPT IS A TAD BIT WEAK. THE ACTOR WITH THE HATCHET FACE WAS AMAZINGLY CREEPY.  GOOD WATCH IF YOUR INTO FEMALE ASSASSIN FILMS.
91586,Insidious: Chapter 2,5.0,"A decent enough movie I suppose, and an interesting sequel, but pales in comparison to the first.

_Final rating:★★½ - Had a lot that appealed to me, didn’t quite work as a whole._"
92182,Silent House,3.0,"Called 95% of the ending within the first 5 minutes, and boy did I hate that camera work. But I managed to make it through the 87 minute runtime more or less unscathed, mostly thanks to lead peformer Elizabeth Olsen.

_Final rating:★½: - Boring/disappointing. Avoid where possible._"
92233,The Forbidden Photos of a Lady Above Suspicion,7.0,"Just has enough about it.

<em>'The Forbidden Photos of a Lady Above Suspicion'</em> includes good performances from Dagmar Lassander, Pier Paolo Capponi, Simón Andreu and Nieves Navarro. It's also paced well enough, despite a few slower moments, and has a solid ending. The film is also short at around 90mins and features a neat score from a certain Ennio Morricone."
92682,Parent Trap: Hawaiian Honeymoon,6.0,"Good watch, probably won't watch again, and can't recommend.

I can't believe it took 3 movies to get back to being relatively charming again.

We get the triplet shuffle this time, dealing with the girls' dates in a positive fashion, we get twin shuffling, and the plot of ""we inherited a tiny Hawaiian hotel"" is one that I want to see again!

It's not a great movie by far, but it was fun."
92694,Hell's Trap,4.0,"Not so much bad but just all around dull. On the plus side, some of the gore effects were okay and a nice little explosion in there but I found my mind wandering a few times. **2.25/5**"
92725,The Naked Witch,2.0,"The first eight and a half minutes are consumed by a detailed examination of at least one painting by Hieronymus Bosch.

The remaining 51 minutes are consumed by a really, really awful movie.  This movie is so bad that it wraps around through good and into mediocre.  The titular Naked Witch never appears more than topless and what passes for acting in this movie is similarly underwhelming."
92750,David and Goliath,7.0,"This was interesting, and I watched it only because I both love swords-and-sandals epics and am a huge Orson Welles fan. This gets huge bonus points because only Welles would insist on making sure he got to direct every scene that he acted in. That's awesome--and craftsmanship and artistry such as his should never be denied, simply for the sake of cinema."
94134,The Man from Toronto,7.0,"One of the earliest adorable romantic comedies with UK's Jessie Matthews. Who was already bubbly, but had yet to stumble across the musical formula which would produce her best films like Evergreen (1934), First a Girl (1935), It's Love Again (1936) and Sailing Along (1938). Still very enjoyable in all it's predictability thanks to this sweet gal."
94329,The Raid,7.0,"Oh, good, the plot, the dialogues and the performances of the characters are plainly terrible.

Other than that, if you are looking for an action movie with tons of ""dancing"" fights, this is your movie."
94329,The Raid,8.0,"Despite being an early entry, _The Raid_ is arguably the most revolutionary action movie of the past decade. And the decade is almost over. Iko Uwais is clear talent when it comes to this sort of stunt work, and with the exception of a little too much shakey-cam near the start, you get a really look at him (and the rest of the cast) doing their thing, a lesson which the majority of Hollywood action movies nowadays apparently needs to re-learn.

_Final rating:★★★★ - Very strong appeal. A personal favourite._"
94348,Alex Cross,6.0,"Not bad, thought it was going to be a lot worse. It was ok."
94363,Hick,6.0,"**Spoiler Alert!**

I didn't like the story, not that it was bad, I just don't like when children are prey for pedophiles, which occurs in this story.  Luli wants a baby brother and instead, her parents leave her almost all the guys in the movie start sexually assaulting her, and to make matters worse she starts to be manipulated by a psychopath who is also a pedophile.  Actors, music, and others good."
94603,Strippers vs. Werewolves,4.0,"Not a great film, but certainly satisfies the blood & tits quotient.

Final rating:★★ - Had some things that appeal to me, but a poor finished product."
94741,The Don Is Dead,7.0,"Unambitious but still entertaining enough mafia crime-drama featuring pretty good performances, for the most part anyway, that likely came about due to the success of The Godfather, released a year prior (I assume many studios were buying up rights to other mafia-based novels). Anthony Quinn is quite good, as is Robert Forster save for a scene upon hearing about the death of his father, there the emotion felt hollow. But otherwise, it's a passable crime-drama worth checking out. **3.25/5**"
94752,The Doll Squad,4.0,Pretty boring action-thriller that has a few fun good-bad moments but as a whole I was disengaged with the whole thing. Only thing that had me interested was finding out this possibly was the inspiration behind Charlie's Angels. Not one I'll ever revisit. **2.0/5**
94901,About Cherry,3.0,"An OK script that is marred by bad acting and completely lackluster camera work. I feel like I need to blame James Franco yet again. Yes, I think I will.

""It is entirely James Franco's fault that this movie sucks."""
94935,Deool,10.0,"So daring excellent take on cultural values in globalized economy like India, satire at its best."
95415,Anarchy TV,10.0,"Hilarious social satire that skewers American media and politics. It's over-the-top and in your face and definitely not for the easily offended, but if you like wacky political satire, this is for you."
95516,Cleanskin,4.0,"It's a format I've seen before in British crime thriller/political intrigue films, a format I'm not particularly fond of, and _Cleanskin_ isn't even a well done example of it. No letdowns in the acting department though, so credit where credit's due.

_Final rating:★★ - Had some things that appeal to me, but a poor finished product._"
96133,Vengeance,6.0,"OK spaghetti western. Could and should have been better. Great opening scene, some nice spaghetti elements held down by a lousy score and a lead with no presence who doesn't resemble in the least a 'half-breed'. Camaso is good but you have to wait for him."
96724,Anna Karenina,8.0,"The stylistic use of the stage drifted between excessive and under-utilised, occasionally falling into perfect balance, of which the ballroom dance scene between Kitty, Vronsky and Anna Karenina is the prime example.

The film tells its story closer to the way a ballet’s is told."
97020,RoboCop,4.0,"Decent remake with well done FX and with quite an impressive cast that keeps a proper level... but flat.

No only it doesn't contribute anything new to the prior movie but also lacks on humor and deeper psychological insight."
97107,The Land Has Eyes,7.0,"A fairly solid movie.

I got the required amount out of <em>'The Land Has Eyes'</em>. Sapeta Taito leads a decent cast nicely, portraying a story that holds suitable intrigue and drama - it gets hearty at one particularly moment too. Of course it isn't a perfect movie, the pacing for one could've been slightly improved, but for what it is I had a pleasant enough time with it.

Cool seeing the visuals of Rotuma, a dependency of Fiji, on the silver screen. Hopefully there'll be more in the future."
97340,Black's Game,5.0,"A template gangster movie that with little adaptation could be set anywhere in Europe in the last thirty years or so. Satisfies an urgent need for action and is easily forgotten after. The story is as predictable as can be and characters fill their cut out roles. Worth mentioning is the well performed, although one dimensional, crime lord Bruno by Damon Younger. Not a bad movie for its genre but also nothing special."
97365,Rust and Bone,9.0,"Marion Cotillard and Matthias Schoenaerts stun in this exceptional drama/romance. 

Driven by intense inner demons, Schoenaerts destroys everything around him, only to build it back up in a gripping climax that nearly had me in tears. 

This was amazing. I have loved everything that I've seen Schoenaerts in and I look forward to exploring more."
97370,Under the Skin,6.0,"Johansson makes a great performance in an unlikely role, adding great sensuality to the film, even with her very different looking.

The story and movie on itself is a rarety. Very fresh but, also, kind of an unfinished joke."
97554,The Sleeping Cardinal,6.0,Watchable mystery-drama with Arthur Wontner and Ian Fleming as Sherlock Holmes and Dr. Watson respectively. A bit slow at times but I still was engaged enough with the mystery element and liked Wontner's portrayal of the classic character. **3.25/5**
97630,Zero Dark Thirty,5.0,Quite a flat movie. The story is interesting and also the fact that it shows how US has used tortures (which everybody but some US citizens already knew) but not much more than that.
98238,The White Meadows,8.0,"Stunning imagery. Whether interpreted as allegory or Kafkaesque nightmare, this is a prime example of the upper tier in art film. The end seemed somewhat out of place after the mesmerizing journeys through Lake Urmia in northwestern Iran. The director and others were jailed for making it. This film warrants multiple viewings."
99099,Shogun's Joy of Torture,6.0,"Not quite sure what to make of this. It is my first foray into the ""pinky violent"" subgenre. Supposedly the three stories were partially based on documentation of real stories and each one is pretty bizarre and while not very good, can't say it's bad either, just doesn't have much substance other than men's desire to torture I guess. **3.0/5**"
99186,"Joe Bonamassa - Beacon Theatre, Live from New York",9.5,"Features guest appearances by Paul Rodgers, John Hiatt and Beth Hart. Hart joins Bonamassa for “I’ll Take Care of You” and “Sinner’s Prayer” from their album 2011 album Don't Explain album. Rodgers and Bonamassa perform “Fire And Water” and “Walk in My Shadows”"
