Movie ID,Movie Title,Rating,Review
58,Pirates of the Caribbean: Dead Man's Chest,8.0,Part 2 introduces Davy Jones. Jack Sparrow has owed Davy a debt. Now Davy intends to make Jack make good on that debt. One way or another. Really awesome sequel.
59,A History of Violence,7.0,"Probably Cronenberg's most mundane work, but that's not even remotely a knock against _A History of Violence_. I hear tell that fans of the comic don't much like this big screen re-telling, but I've never read it, so I'm gonna go ahead and really enjoy it anyway.

_Final rating:★★★½ - I really liked it. Would strongly recommend you give it your time._"
62,2001: A Space Odyssey,8.0,"I believe that we should call it a modernism show, albeit exhibited in the form of a movie. While it might feel ""boring"", it forces you to rethink what philosophical level that a two-hour film can achieve. The focus on questions about life, intelligence, and time, is worth more attention than the sci-fi part (though the special effect of this movie is already way ahead of its time)."
62,2001: A Space Odyssey,10.0,"The eighth wonder of the world. Easily 30+ viewings since I was a little kid. Nothing new to say here; simply wanted to add another pair of hands to the ocean of applause for my absolute favorite thing, the only indisputably perfect movie, the answer to the question of Is Life Worth Living, Man's greatest achievement, two thousand one a burger-flipping space odyssey"
62,2001: A Space Odyssey,10.0,"Absolute classic, must see, one of the best scifi movies ever made"
63,Twelve Monkeys,8.0,"Really good sci-fi thriller with wonderful performances by Bruce Willis, Madeline Stowe and Brad Pitt. Really well done by director Terry Gilliam that has great pacing through the two hour running time. **4.0/5**"
64,Talk to Her,8.0,"Now this is…really something different like the story and Benigno. I know what he did was so so wrong but I felt bad for him. Such a heartbreaking story and I love how the friendship was formed, although I really didn’t care about the writer and matador. I just couldn’t stop watching this film when I saw it on Sundance, until the ending, like the butt shakin partner dance before the end credits. It may be the music. And of course…Paz Vega’s black and white silent film, the shrinking man who went inside her…literally!"
65,8 Mile,6.0,Eminem turned out to be a pretty decent actor. I love battle raps. Honestly he's one of if not the best to ever do it!
68,Brazil,10.0,"One of my all time favourite sci fi movies. Set the bench mark for modern sci fi, should be considered a great like Blade Runner.
Great acting, story, soundtrack! 5/5"
73,American History X,9.0,"Despite having a somewhat weak cast, this is an incredibly poignant drama of one man's struggle to live a new life. Probably too violent and close-to-home for some."
73,American History X,5.0,There's really no point to the movie. Just a lot of violence. That's pretty much it.
74,War of the Worlds,5.0,"First time seeing this in 15 years and lame plot, annoying characters (both kids got on my nerves) and a protagonist who just runs around, as Tom Cruise does so well, but has zero impact on the end game which was... bacteria. Yeah, this was just as dumb today as it was back then. At least the visual effects and sound design still holds up. **2.5/5**"
74,War of the Worlds,8.0,"An intense, serious and harrowing portrayal of the H.G. Wells classic. Tom Cruise doing an excellent job of not being Tom Cruise and Dakota Fanning out acting everyone. It's hard to call this film an enjoyable watch as it's actually emotionally affecting at times, with some very raw realism concerning human nature. This movie manages to keep a constantly high pace without being exhausting to watch. Well worth a place in your collection."
77,Memento,10.0,"Excellent. I can't believe I've finally gotten around to watching all of Christopher Nolan's films (I have 'The Prestige' on DVD, but have yet to see it), but it's been well worth the wait. There are a couple of handful of English-language directors operating right now that I will make sure I watch every single film of, and Nolan has become one of those for me, and rightfully so. A very fine twist on the noir framework."
77,Memento,8.0,"Structuring the film in such a way that the viewer knows as little as the protagonist, the Nolan's have created a nifty puzzle that slowly unravels to its climax.

8/10"
77,Memento,7.0,"A similar style to Inception, pay attention or you’ll lose it"
78,Blade Runner,8.0,"Some people will say this classic sci-fi ""has nothing to offer other than overrated cult-status"". To that, I would respond, ""it has Rutger Hauer on a rooftop, and that's enough for me"".

_Final rating:★★★★ - Very strong appeal. A personal favourite._

(3.5 for the Theatrical Cut, 4.0 for the Final Cut)"
82,Miami Vice,8.0,"This is one I saw back in theaters and don't remember caring much for perhaps due to the stark shift in direction with the digital format and over-saturation (compare that to Heat) but seems like the 16 years since, not only with Mann's Collateral, but other films have adopted something similar, that this time around it didn't look or feel off. As for the movie itself, solid storyline and the performances from Jamie Foxx and Colin Farrell were really good, now I wish there was a sequel but that time has passed unless Universal goes the streaming route. **4.0/5**"
83,Open Water,3.0,"If you like Extreme EXTREME Close Ups filmed on an iPod Shuffle, then oo boy do I have the film for you.

_Final rating:★½: - Boring/disappointing. Avoid where possible._"
85,Raiders of the Lost Ark,10.0,"5 stars ⭐️⭐️⭐️⭐️⭐️

My favorite action film of all time due to one of the most iconic death scenes at the end being my personal favorite and being featured in my melt movie lists on many different websites!!!"
87,Indiana Jones and the Temple of Doom,5.0,"Simultaneously both more grim and more silly than the Indiana Jones films either side of it, _The Temple of Doom_ was my favourite of the series as a kid. As an adult though, it seems it is objectively the worst movie in the trilogy, but damn if there isn't a lot of memorable parts to love about it.

_Final rating:★★½ - Had a lot that appealed to me, didn’t quite work as a whole._"
88,Dirty Dancing,7.0,"A pretty simplistic film with a plot that's more of an excuse to show dance scenes and an extremely surface level handling of the issues of gender and class that it raises, but it's pretty cute and also I'm bisexual so I like it anyway."
88,Dirty Dancing,6.0,An ok movie. A lot of cheesy parts that I didn't like. I did like the dancing and the love story. I guess it was better at that time.
89,Indiana Jones and the Last Crusade,7.0,"It feels very much a retread of _Raiders_. But, that was a great movie, so it's not exactly as if that's a bad plan.

_Final rating:★★★½ - I really liked it. Would strongly recommend you give it your time._"
95,Armageddon,8.0,"Directed by Michael Bay, co-written by J.J. Abrams and starring Bruce Willis just being Bruce Willis while he saves the world from a giant asteroid with a proper bunch of misfits and some oil drilling equipment. I'm in!"
95,Armageddon,7.0,Another end of the world movie. Not really action more drama then anything. It's an unlikely team that saves the world.
96,Beverly Hills Cop II,7.0,"Entertaining enough sequel isn't as sharp as the original and some parts felt like Murphy's stand-up routine, and while the plot itself was weak, did enjoy the on-screen friendships between Murphy, Reinhold and Ashton. **3.5/5**"
98,Gladiator,8.0,"Ridley Scott's Gladiator is a real masterpiece of its genre. With its unique battle scenes, cinematography, acting and directing. It's a real must-watch. Shame on you if you haven't watched this movie!"
98,Gladiator,10.0,"An epic old movie, an absolute must watch. Even now, I can’t resist running my hands over tall plants whenever I pass by them"
99,All About My Mother,10.0,"Of course, it's an Almodovar, so it's already a great film. But this one - the artistic shots, the characters, the story, the humanity - all top notch. I think this film might be his best."
100,"Lock, Stock and Two Smoking Barrels",3.0,"Far from being a good movie, with tons of flaws but already pointing to the pattern of the whole Ritchie's filmography."
100,"Lock, Stock and Two Smoking Barrels",9.0,"Genuinely one of my favorite movies of all time. Watched again recently and realised how well written, brilliantly shot, beautifully cast and cleverly produced this movie actually is!"
101,Léon: The Professional,10.0,"HOW TO MAKE A FEMALE ASSASSIN. TRAUMA, TRAINING THEN GET HER EXTRA ANGRY.  NATILIE PORTMANS FIRST ASSASSIN ROLE AND HOPEFULLY NOT HER LAST.  WE NEED A PART 2 TO THIS MOVIE."
104,Run Lola Run,5.0,"Stupid criminal is stupid and expects his girlfriend to bail him out and fix his problems. We watch 3 different scenarios of her running around trying to come up with money. More stupid stuff happens and she screams to try to make things go her way. Yes, literally screams. Ridiculous"
105,Back to the Future,8.0,"**Entertaining**

A man goes back in time to save his mother - or something like that anyway - I was too entertained to fully grasp what was going on.  Seriously, this film moves so fast that you will find yourself having to try your hardest to keep up with it.

Great movie. Great soundtrack. Great performances. A shame that the sequels did not live up to this one. 

- Ian Beale"
105,Back to the Future,9.0,Not sure how many times I've seen this (first time was on VHS ~1986 or 87 I think) but still an incredibly fun sci-fi comedy with Fox and Lloyd working perfectly off one another. Holds up so well each and every time I re-visit. **4.5/5**
105,Back to the Future,6.0,Everyone who's ever seen this movie loves it. We all wish we could go back in time. I know I do.
105,Back to the Future,8.0,A quintasential '80s movie. A time-jumping rollercoaster ride everyone will enjoy getting on board.
105,Back to the Future,9.0,The first time I saw this movie I was 6 or 7 years old and my friend had it on VHS and since then I can't count the number of times I have seen it. Such a fun time travel adventure movie.
107,Snatch,10.0,"Peak cinema. I absolutely love this movie, this is a fast-paced, filled with jokes and charismatic characters rollercoaster that's definetely worth watching"
111,Scarface,9.0,"Immensely great crime-drama that features some great performances and excellent writing from Oliver Stone (and this coming from someone who isn't a big fan of his) to the direction by Brian De Palma. The score is great though still love the song ""Take It to the Limit"" during the money laundering scene. Still a few slots below the likes of The Godfather and Heat, yet still a amazing film that holds up so well. **4.5/5**"
114,Pretty Woman,7.0,"""You and I are such similar creatures, Vivian. We both screw people for money.""

Richard Gere has always played a rich snob really well but I can't help shake the feeling that Julia Roberts was shockingly miscast in this role. She does well but the role just doesn't fit. Oh well, can't win them all."
114,Pretty Woman,6.0,"Pretty average movie. The dialog is maybe a bit ahead of its' time, in terms of toxicity and progressivism, but that's a few lines.
Feels really sappy and cardboard. The cast has great charisma, but they can't help playing cardboard in such a simple play. I'm not sure how exactly modern fairytales are made good, but most I've seen are better than this.

6/10"
115,The Big Lebowski,10.0,"Fun, clever and engaging. Joel & Eitan Cohen's most iconic creation"
116,Match Point,3.0,"_Match Point, or, Crime & Misdemeanors, Except I Changed Like 4 Things, And the Mistress is Really Hot This Time_"
118,Charlie and the Chocolate Factory,7.0,Not as good as the original but still good nonetheless. Johnny Depp is really the only reason this movie was good. I think any other actor that would have played that character would have made the movie suck.
120,The Lord of the Rings: The Fellowship of the Ring,10.0,"An epic movie if I ever saw one. Captivating and just plain fun to watch. This movie is, indeed, art."
120,The Lord of the Rings: The Fellowship of the Ring,9.0,"Lost count how many times I've seen the ""The Fellowship of the Ring"" but still fantastic after all these years, epic on every level and just all around entertaining, the 3.5 running time just flies by. Will be watching ""The Two Towers"" either tonight or tomorrow followed by ""The Return of the King"". **4.75/5**"
121,The Lord of the Rings: The Two Towers,9.0,"Still probably my favorite of the three, while it's pretty streamlined and far more action centric with little development compared with Fellowship of the Ring and Return of the King, I always find this one really entertaining with the Helm's Deep battle. **4.5/5**"
122,The Lord of the Rings: The Return of the King,10.0,"Great finale to a great trilogy. The action and battle sequences were amazing and even though I've seen this a few times over the years, still thrilling to the end. I didn't even mind the multiple endings as I had in the past, nice each character got their due. **4.75/5**"
128,Princess Mononoke,10.0,Probably the best movie from Miyazaki. A mixture of old Japanese traditions with the story about the conflict between the industrial human being and the preservation of the Nature.
128,Princess Mononoke,10.0,"Hayao Miyazaki's arts have always something to remember us that we are naturally harmonized with mother earth and existences. There is still a bond, if one is hurt another, it means the one suffer itself as well."
128,Princess Mononoke,9.0,This is my favorite movie from Miyazaki. The visuals are great. The characters are great. The voice acting (English version) is great. The animation is great. Music is great. The story is good. Everything about this movie is so cool and it's just really fun to watch.
129,Spirited Away,10.0,"One of the great ""masters"" of the anime art. Somehow, if I would personally associate ""Akira"" to ""self-destruction"", then this anime would be the opposite :)"
134,"O Brother, Where Art Thou?",6.0,Weird convicts that escape. With no money they try to find treasure. Has some weird comedy as well. Good cast though.
135,Dont Look Back,9.0,"I'm a huge fan of both Bob Dylan and D.A. Pennebaker's documentaries, so to me, this was a no-brainer to watch, especially this vintage. I was fortunate to catch Dylan live, after his life-threatening bout of pericarditis, in Ann Arbor, Michigan at the Hill Auditorium with the Kenny Wayne Shepherd band as support, but how amazing it would have been to have caught him live on this British tour, from a generation earlier.

I would have given it a perfect rating, but I docked a mark for him making fun of Donovan, for crying out loud."
137,Groundhog Day,7.0,"Funny story done to fit on Bill Murray's shoes.

It is good enough and with a moral for the family but I don't get it what this is such a famous movie."
137,Groundhog Day,9.0,"Fantastic watch, will watch again, and do recommend.

Bill Murray carries this time-shift-loop adventure in hilarious form.  The writing is excellent with a ""redeemable protagonist"" trope mixed in.

The movie is creative with it's divergent time lines and even manages to maintain proper story arcs as Phil continues to loop.

The supporting cast is wonderful in each of their roles, and manage to do repeat acting excellently.

This was a popularizing (if not a birth) to a genre, everyone should have watched this movie at some point."
138,Dracula,8.0,"Probably my third or fourth time seeing this and while the story is simple, still really entertaining and Bela Lugosi, who even as a favorite of mine acknowledge was never the strongest actor, is in his element. Also has some decent effects and nice set design for the era. **4.0/5**"
138,Dracula,10.0,"""The blood is the life, Mr. REINFIELD""



At three years old this was my first horror movie. My great-grandmother is the one who sat me down and showed me great Bela Lugosi as Dracula. This entire movie is timeless and classic. The very best of all the Universal horrors.

No one could be a more perfect Dracula than Bela Lugosi. To accomplish so much with just a stare. No special effects. No fangs... yet he chilled you to the bone and enthralled all.

One of my all-time favorites. Classic Cinema perfection."
141,Donnie Darko,7.0,"Interesting movie with several readings.

As with 2001: A Space Odissey, it is needed a reading of the actual explanation for the events to fully understand the original idea ... if you are interested in such explanation ..."
141,Donnie Darko,9.0,"A complete mind-bender of a movie that put Jake Gyllenhall on the map, introduced the creepiest rabbit costume of all time, and may make you surprisingly tear up to a remake of Tears for Fears ""Mad World."""
143,All Quiet on the Western Front,9.0,"This very dark, intense film about the horror and brutality of war focuses on a group of young German soldiers fighting at the front during WWI.  It's brilliant, raw, and compellingly honest.  Lew Ayers, only 20 years old at the time, does a very fine job.  Based on Remarque's famous book, this is a classic, stunning piece of cinema, which earned Best Picture and Director Oscars.  The ending is haunting and very disturbing, and it will stay with you long afterward.

Would I recommend?  Yes, but for more mature audiences who can really take it in."
150,48 Hrs.,6.0,Entertaining buddy action-comedy that features a good antagonistic relationship between Nolte and Murphy. The plot isn't the strongest but the action/fight scenes were alright. **3.25/5**
150,48 Hrs.,6.0,Back to the old school. Love this movie. This is when cop movies started to have some comedy in it.
152,Star Trek: The Motion Picture,1.0,"BORING.

I mean, it opens great. The first few minutes sort of give you the impression that this movie is going to be epic...

... and then the rest of it is best spent looking at your phone, cleaning your finger nails, watching linoleum curl, defrosting your freezer...

... finding anything else you can do as it plays in the background just to keep you form dying of Boredom.

And I say this as a Star Trek fan."
153,Lost in Translation,10.0,"Lost in Translation is one of my all-time favorite movies. The film grabbed me when I first saw it in the theater (unusual for back then, but my cineplex got this one in) and since I've watched it dozens of times. Bill Murray and Scarlet Johansson are both great and Sofia Coppola's direction taking in the sights and sounds of Tokyo (a city I've always been curious about and wanted to visit) was amazing."
155,The Dark Knight,10.0,"A Masterpiece!!! I Love how The Dark Knight shows to me the ""Dark & Gritty Tone"". Overall, Nolan give us the Game changing, best superhero film OF ALL TIME. For me it's 10/10"
155,The Dark Knight,10.0,"Unforgettable crime film with good dialogue, thrilling action and chase scenes and once again a magnificent cast (most notably a terrifically terrifying Ledger) and superb score.

10/10"
155,The Dark Knight,7.0,I enjoyed watching the Dark Knight. They were at least able to keep the same batman from the the last one made too.
155,The Dark Knight,8.0,If I can hold my pee for a whole two and a half hours rewatching a film I’ve already seen then I love it.
155,The Dark Knight,10.0,I'm deeply in romantical love with the joker. this movie made my delusions worse
157,Star Trek III: The Search for Spock,7.0,"I kind of feel that this gets a lot more hate than it deserves... because it follows Kahn and because it rewrites an emotional death.

I know, I know, I love Spock too, but, really, should have left him dead. That was part of the emotional roller coaster of II.

But, they didn't and that does sort of cheapen Kahn a bit.

However, it's really not a bad entry on it's own. It's a solid film. It just followed the greatest of the bunch and pales in comparison."
161,Ocean's Eleven,9.0,"_""Congratulations, you're a dead man.""_

I mean, this might be the best remake of all time right? I don't like using the term masterpiece but this is pretty close to that. Ensembles are not easy to do well but Soderbergh was able to get this group of beutiful people, make a charming picture and it's got everything you want in a heist movie."
161,Ocean's Eleven,9.0,"> ""Congratulations, you're a dead man.""

I mean, this might be the best remake of all time right? I don't like using the term masterpiece but this is pretty close to that. Ensembles are not easy to do well but Soderbergh was able to get this group of beutiful people, make a charming picture and it's got everything you want in a heist movie."
162,Edward Scissorhands,8.0,Love this movie. It's like a non evil Freddy Kruger. The ending could have been better though.
163,Ocean's Twelve,7.0,"> ""Come on, he's one guy, and he's French.""

Ocean's series goes global and I love it. The scenery, the music, the stellar cast... they did it again. I would say while this is about heists again, it doesn't focus on it as much, but I am cool with that because the storytelling, twists and cast are just so good."
165,Back to the Future Part II,8.0,"This was one I think I was slightly disappointed in when I first saw it in theaters back in '89 and even with subsequent viewings on VHS and DVD, however I've come to appreciate it more over the years post-2000s. Lots of fun though feels disjointed at times going back and forth in time from 1985 to 2015 to alternate 1985 and back to 1955. But I did like the technical aspects re-creating the events of the first movie. **4.0/5**

PS: Still remember back in the day seeing a TV special and believing the hoverboard was real, lol."
165,Back to the Future Part II,8.0,"My favorite out of the series. I like this one better, because your rewatching the 1st one as the 2nd one is helping the 1st one at the same time. So you get to enjoy the 1st one again with new twists added from the 2nd one. But you can't see yourself watching the 1st one while watching the 2nd one, because the 1st one is not suppose to see the 2nd one watching it, and vice versa. Otherwise something bad will happen if the 1st and 2nd one see each other. Lol you get what I'm saying!"
168,Star Trek IV: The Voyage Home,1.0,"I guess when I was 6 i liked it, and every generation needs it's time travel movie doesn't it?

But, no, bringing them back to contemporary 80s earth just doesn't work. It's sort of too close to home to be good. Star Trek is Sci-Fi, sure, but this just doesn't work.

They live in a future that COULD be, with it's own history, it's own mythology, and taking the crew of the Enterprise back to our world just makes them feel more out of place than the comedic tone of the film intended."
170,28 Days Later,7.0,"**mild abstract spoiler ahead**

My feelings about this movie may very well be extended towards Boyle's movies in general : solid direction overall, but events did not fail to go from situational and behavioral realism to sudden heroical action nonsense."
170,28 Days Later,8.0,"_28 Days Later_ was made on a very small budget in the early days of digital cinema, so, yes, in retrospect, it does look a little bit like it was shot on a Nokia 3310, and yes, it is heavily responsible for the bilious deluge of zombie movies we got in its wake, which we are only now finally recovering from - but it's so **good**. 

_Final rating:★★★★ - Very strong appeal. A personal favourite._"
175,The Big Blue,6.5,"Introspective story with a good Jean Reno and innocent Rosanna Arquette.

Sound track, for those loving Eric Sierra. Not for all tastes. A little bit too long but entartaining."
180,Minority Report,6.0,"Works more on the strength of Spielberg than of Cruise.

_Final rating:★★★ - I personally recommend you give it a go._"
180,Minority Report,8.0,Really good movie. This is one of those movies where you really gotta pay attention to it to understand it fully. Great storyline too. I'm sure our world will eventually end up this way. Hope not though!
183,The Wizard,5.0,"Has some heart at times, almost ruined by the blatant and, hate to use this word, cringe-worthy product placement from Hostess to Nintendo to Universal Studios (which makes sense since this was one of their movies). The acting and writing is bad and I'm not quite sure who this movie was made for (there is a joke about a teenage girl accusing a grown man of grabbing her breast) but there are some funny bad moments. **2.75/5**"
185,A Clockwork Orange,7.0,"Some great visuals and direction not to mention an incredible performance from Malcolm McDowell, I wasn't totally into this, the first half especially was taxing to get through to the point I stopped watching and only finished a couple days later. The rest was good and found myself a bit more engaged however as a whole, this one never grabbed me. **3.5/5**"
189,Sin City: A Dame to Kill For,6.0,"It's just not as good as the first. They over use colour, instead of tiny splashes here and there it's everywhere and it doesn't work

Eva Green is absolutely perfect as Ava, I just wish her story was in the first film"
192,The Name of the Rose,6.0,"At first I was like ""Hah, this is some kind of Sherlock Holmes but a priest thing!"", and then I was like ""Oh, this **is** some kind of Sherlock Holmes but a priest thing!""

_Final rating:★★★ - I liked it. Would personally recommend you give it a go._"
